web-scraper-order,web-scraper-start-url,politics,politics-href,headline,date,author,article,image-src
"1648571334-1178","https://www.nytimes.com/section/politics","Marco Rubio Leads G.O.P. Push for a More Combative Stance on ChinaIt’s time for Americans to buckle down for a long struggle with Beijing, the Florida senator will argue in a speech.By Blake Hounshell and Leah Askarinam","https://www.nytimes.com/2022/03/28/us/politics/marco-rubio-china-republicans.html","Marco Rubio Leads G.O.P. Push for a More Combative Stance on China","Published March 28, 2022","Blake Hounshell","Marco Rubio wants Americans to “wake up.”China is already locked in conflict with the United States, the Republican senator from Florida warns. We just haven’t realized it yet.And even as Vladimir Putin’s assault on Ukraine shows that wars of aggression are no relic of the past — the “return of history,” Rubio calls it — he worries that China’s Communist rulers pose a more insidious, long-term danger to America’s peace and prosperity, and that the threat isn’t being treated with the seriousness it deserves.“It does us no good to pretend they’re not an adversary,” Rubio said in an interview. “Their goal is to rise at the expense of the United States.”As the top Republican on the Senate Select Intelligence Committee, Rubio has access to the latest insights from U.S. spy agencies. And what he has seen of China’s growing reach has alarmed him: a campaign of economic espionage and infiltration of American institutions; a rapid buildup of nuclear and conventional forces that menace Taiwan; an expanding disinformation machine that seeks to undermine the U.S. all over the world.AdvertisementContinue reading the main storyThose concerns are widely shared by Democrats in Washington. Since taking office, the Biden administration has taken steps to bolster America’s alliances in Asia, reoriented NATO toward confronting China, approved nearly $1 billion in arms sales to Taiwan, hit Chinese officials with sanctions, and sharply criticized China’s human rights policies and trade practices. Congress is busy finalizing the COMPETES Act, a mammoth piece of legislation both parties have framed as vital to countering China. But if Republicans take control of Congress in November, they will be in position to push for an even harder line.On Tuesday, Rubio will give a speech at the conservative Heritage Foundation, in which he plans to argue that “Beijing’s military might, ideological challenge to democracy, technological ambitions and influence over the global market pose an even more serious and systematic threat than the Soviet Union ever did.”Winning that conflict blinded Americans to the dark reality of totalitarianism, in Rubio’s telling. “Over the past three decades, we forgot that human nature tends toward a lust for domination,” read portions of his remarks that were shared with The New York Times. “The desire of the powerful to conquer, enslave and control those weaker than themselves.”What America needs above all else, Rubio argues, is “unity and clarity about the threat we face.”The speech is a forceful entry into the debate in Washington and among Republicans over how to deal with Beijing. How much emphasis should U.S. leaders place on Russia versus China? Is China an adversary to be combated or merely a fierce competitor? Is the United States losing its edge? And, if so, what is to be done about it?Rubio’s own Twitter feed embodies the competing demands on policymakers’ attention. Even as he hones his arguments on China, he’s been live-tweeting his insights on the war in Ukraine.AdvertisementContinue reading the main story“Republicans are wrestling with whether and how to prioritize these threats,” said Elbridge Colby, who was a senior defense official in the Trump administration. “But the truth is that we’re not just going to rewind the clock to 1989 and everything’s going to be like the old days.”A drive to out-hawk the hawksRepublicans may be divided on Russia — between mainstream national security hawks and a smaller faction that admires Putin’s perceived toughness and his defense of traditional values — but criticizing China is a surefire political winner on the right.In a poll conducted last year, nearly half of Americans said they viewed China as the greatest enemy of the United States, a number double what it was 2020. In a survey last year by the Chicago Council on Global Affairs, 64 percent of Republicans said the United States should try to limit China’s rise, whereas 60 percent of Democrats said they preferred cooperation and engagement.“Republicans are very negative toward China, more so than Democrats,” said Glen Bolger, a Republican pollster. He noted that the coronavirus pandemic had fueled growing skepticism of China and its role in the world.China is already proving to be a potent campaign issue in the 2022 midterms, as Republican politicians try to out-hawk one another in primaries for congressional seats. In Midwestern states hobbled by the loss of manufacturing jobs, it’s a domestic policy topic as much as it is a national security concern.In Ohio, Mike Gibbons, a businessman who is leading the Senate Republican primary in some polls, is fending off allegations that he once favored outsourcing jobs to China.In Pennsylvania’s Senate race, David McCormick, a former hedge fund executive, and Mehmet Oz, the celebrity doctor, are trading accusations over who is more tainted by Beijing.AdvertisementContinue reading the main storyFor Rubio, his first task is to get re-elected in Florida this year. But he has run for president once before, and allies expect he may do so again. So his bid to lay down a marker on China is bound to raise questions about his ambitions for 2024.ImageIn an upcoming speech, Rubio plans to argue that China poses “an even more serious and systematic threat than the Soviet Union ever did.”Credit...Sarahbeth Maney/The New York TimesA rival the U.S. is highly dependent onIf China’s a more serious geopolitical threat than the Soviet Union, it’s also a more complex one.Americans traded more than $600 billion worth of goods and services with China in 2020 alone, dwarfing the amount the United States ever exchanged with the Soviets. The U.S. also depends on China for raw materials like rare earth minerals, used in everything from mobile phones to semiconductors to car batteries. And Beijing’s cooperation is essential to making progress on climate change, Biden administration officials emphasize.In the event of a war over Taiwan, Rubio said, “It won’t be as easy to sanction China as it was to sanction Putin.” Not only can China wield far greater military and financial muscle than Russia, but American elites are also more deeply compromised by their ties to Beijing, he argued.“China’s been very effective at deputizing the American corporate sector as their lobbyists,” Rubio said. It’s something he says he experienced firsthand when he pushed for sanctions over China’s treatment of its Muslim minority.The administration has resisted labeling China as an outright enemy, even as it steps up its criticism of the Chinese government. During his speech last year to the U.N. General Assembly, President Biden said, “We are not seeking a new Cold War or a world divided into rigid blocs.”But the White House’s actions suggest otherwise. The budget it released today mentions China 12 times, referring to the country as a “pacing challenge.” It calls for a Pentagon budget of $773 billion — a record that eclipses the Trump administration’s spending on the military.AdvertisementContinue reading the main storyImageWhat to read tonightA federal judge ruled that former President Donald Trump most likely committed felonies, Luke Broadwater and Alan Feuer report, including obstructing the work of Congress and conspiring to defraud the United States.The House committee investigating the Jan. 6 riot at the Capitol is looking to interview Virginia Thomas, the wife of Justice Clarence Thomas, Broadwater reports. The request comes after a public uproar over the disclosure of her text messages expressing support for efforts to overturn Biden’s election.President Biden stood by his remark that Vladimir Putin should not remain as president of Russia, though he told reporters that he had only been expressing “moral outrage,” not calling for regime change in Moscow. Follow our live updates on Ukraine here.Imagebriefing bookImagePresident Biden is facing some of the lowest job approval numbers of his presidency.Credit...Leigh Vogel for The New York TimesHere comes Biden’s pivot to the middle.White House budgets are political documents. They aren’t meant to be enacted as written. It’s Congress’s job to decide how much money to spend and on what. So it’s worth reading Biden’s newly unveiled $5.8 trillion budget for 2023 for what message the president is trying to send — and what values he’s hoping to convey.With Biden facing some of the lowest job approval numbers of his presidency, this looks a lot like a shuffle to the center ahead of the midterms, as Jonathan Weisman assesses. So how is Biden trying to present himself?Tough on deficits. Although it’s debatable whether voters care about deficits, Senator Joe Manchin III of West Virginia certainly does. So the White House is emphasizing that its budget would shrink the federal deficit by $1 trillion over the next decade. More here from Zach Montague and Alan Rappeport.AdvertisementContinue reading the main storyTough on crime. The budget contains billions in requests for federal law enforcement, including $17.4 billion to combat violent crime and more than $30 billion in grants to state and local police departments. There’s also a 5 percent increase for various Homeland Security initiatives. As Katie Benner notes, the message here is pretty simple: Biden does not want to defund the police.Tough on defense. All told, Biden is asking for $813.3 billion in national security spending, a 4 percent bump from 2022. Much of the new money would go to counter threats from China, Iran and Russia. As Michael Shear notes, it’s a far cry from the peace dividend progressives expected from the U.S. withdrawal from Afghanistan.Tough on the wealthy. Biden is proposing a minimum tax on American households worth more than $100 million, an idea in line with what progressives like Bernie Sanders and Elizabeth Warren have championed. Zolan Kanno-Youngs breaks it down here.ImageThanks for reading. We’ll see you tomorrow.— Blake & LeahIs there anything you think we’re missing? Anything you want to see more of? We’d love to hear from you. Email us at onpolitics@nytimes.com.","null"
"1648571339-1182","https://www.nytimes.com/section/politics","Biden Administration Will Start Vaccinating Migrants at BorderSome migrants who refuse will be detained and placed in removal proceedings, according to directions given to homeland security officials.By Eileen Sullivan","https://www.nytimes.com/2022/03/28/us/politics/vaccines-migrants-border.html","Biden Administration Will Start Vaccinating Migrants at Border","null","Eileen Sullivan","WASHINGTON — The Biden administration is requiring coronavirus vaccines for some undocumented migrants at the southwest border, a policy change that comes days before the administration’s next review of a public health order that has limited immigration during the pandemic.Under the plan, officials will start vaccinating undocumented migrants without proof of vaccination who are apprehended by border officials, but not expelled under the public health order, in seven areas including San Diego, El Paso and the Rio Grande Valley. A description of the plan was shared with The New York Times.According to directions given to senior homeland security officials on Sunday, if single adults refuse to be vaccinated, they will be detained and put into deportation proceedings. If they request asylum and cannot remain in detention, they will be released with a monitoring device “with stringent conditions.” If migrant families refuse vaccination, they will also be given monitoring devices with the same conditions.The White House has said little about whether it will soon lift the public health order, which the Trump administration put in place at the start of the pandemic. The order, known as Title 42, gives border officials the authority to turn back migrants seeking to enter the United States so that they do not spread the coronavirus here, a precaution that public health experts have called unnecessary.AdvertisementContinue reading the main storyThe Centers for Disease Control and Prevention is supposed to review whether the rule is still necessary at this stage in the pandemic, and issue a decision in the coming days.The administration’s decision to start vaccinating some undocumented migrants appears to be an acknowledgment that there are measures other than the public health order that can be taken to minimize the spread of the coronavirus across borders. A Department of Homeland Security spokesman said vaccinating immigrants in the department’s custody is a “public health best practice.” The spokesman did not explain why the department had waited so long to put that practice in place with regard to undocumented migrants, many of whom come from Central America. Planning for these vaccinations has been in the works. In November, the administration put out a request for a short-term contract to provide Covid-19 vaccinations at points along the southwest border.Previously, the administration has resisted vaccinating undocumented immigrants, despite multiple proposals from the Department of Homeland Security over the past year on how to do it. President Biden’s domestic policy adviser, Susan Rice, has privately raised concerns that it would provide an incentive for more undocumented migrants to try to cross the border, according to three current and former government officials with knowledge of the ongoing discussions, who spoke on condition of anonymity to discuss internal deliberations.Noah Gottschalk, the global policy lead at Oxfam America, said that argument makes little sense.“Based on our work in the regions and places that people are coming from, that would have absolutely nothing to do with people coming,” he said. “People have access to vaccines. They are coming because they’re fleeing persecution.”AdvertisementContinue reading the main storyInside the Homeland Security Department, officials have been planning for Title 42 to end in early April. They expect large crowds of migrants as a result, exceeding the already-high numbers that have been crossing without documentation in recent weeks.The Coronavirus Pandemic: Latest UpdatesUpdated March 29, 2022, 9:15 a.m. ET3 hours ago3 hours agoHow Shanghai’s lockdown is testing China’s ‘Covid-zero’ policy, and people’s limits.Experts warn of racial disparities in the diagnosis and treatment of long Covid.The Biden administration will start vaccinating migrants at the border.Since President Biden has been in office, there has been a significant spike in the number of migrants crossing the southwest border, many fleeing poverty and persecution. The administration has used the public health rule to expel migrants a little more than half of the time, allowing in others with humanitarian exemptions.Migrant children who arrive at the border without a parent or guardian have been exempted from the rule and allowed to enter. The administration has been offering vaccinations to eligible migrant children in government shelters for months; Immigration and Customs Enforcement has also been offering vaccinations to immigrants in detention. And the administration has been vaccinating asylum-seeking migrants who are waiting in Mexico until the United States makes a decision on their case.Amesh Adalja, a senior scholar at the Johns Hopkins Center for Health Security, said vaccinations should have been offered to all undocumented migrants apprehended on American soil.“There’s no actually valid argument to not vaccinate people at the border, especially when our vaccination rates are the lowest that they’ve been in the United States and we’re actually throwing vaccine in the trash,” Dr. Adalja said. “If they don’t do this, they would rather put vaccine in the trash can than put it into a migrant’s arm, is basically what that amounts to.”Critics of the order say it is being used to control the influx of undocumented migrants. The Biden administration, which has relied heavily on scientific evidence to justify many other health precautions during the pandemic, has not produced data that shows undocumented migrants play a significant role in spreading the coronavirus.In a ruling regarding the use of the policy, a panel of judges on the U.S. Court of Appeals for the District of Columbia Circuit noted the lack of data.AdvertisementContinue reading the main story“We are not cavalier about the risks of Covid-19. And we would be sensitive to declarations in the record by C.D.C. officials testifying to the efficacy” of the public health order, the panel wrote earlier this month. “But there are none.”They added: “From a public-health perspective, based on the limited record before us, it’s far from clear that the C.D.C.’s order serves any purpose.”The White House and Homeland Security Department have consistently said the public health order is issued at the sole discretion of the Centers for Disease Control and Prevention.“It is not a matter of immigration policy,” Alejandro N. Mayorkas, the Homeland Security secretary, said on March 17. The C.D.C. determines the order’s necessity, he said, “on a public health basis, depending on where we are in the arc of the Covid-19 pandemic.”Mr. Mayorkas pointed to the spread of variants in other countries. While Covid case numbers are falling in most of the United States, an Omicron subvariant, BA.2, is fueling an increase in cases in Europe and could cause another surge here, although it does not appear to be causing widespread severe illness.The administration has been fighting in court to keep the public health order in place for migrant families, even though many are already exempted from it. The same appeals panel that noted earlier this month that the C.D.C. had not presented any evidence justifying the order also ruled that the administration could not use it to expel families to countries where they would face persecution or torture.Lawyers were supposed to file a status update last week, but instead asked for an extension until after the C.D.C. decides whether to keep the rule in place.Zolan Kanno-Youngs contributed reporting.","null"
"1648571303-1157","https://www.nytimes.com/section/politics","TimesVideoBiden Says His Remarks About Putin Do Not Change U.S. PolicyPresident Biden stood by his remarks that President Vladimir V. Putin of Russia “cannot remain in power,” but insisted that the comment was a personal expression of outrage and should not be interpreted as a change in American policy.By The New York Times","https://www.nytimes.com/video/us/politics/100000008276822/biden-putin-russia-ukraine.html","Biden Says His Remarks About Putin Do Not Change U.S. PolicyBiden Says His Remarks About Putin Do Not Change U.S. Policy","null","null","null","null"
"1648571342-1186","https://www.nytimes.com/section/politics","Supreme Court to Weigh California Law on Humane Treatment of Pigs","https://www.nytimes.com/2022/03/28/us/politics/supreme-court-california-pigs.html","Supreme Court to Weigh California Law on Humane Treatment of Pigs","null","Adam Liptak","WASHINGTON — The Supreme Court agreed on Monday to hear a challenge to a California law that seeks to address cruelty to animals by requiring that pork sold in the state come from breeding pigs housed in spaces that allow them to move around freely.The law, Proposition 12, a 2018 ballot measure that was approved by more than 60 percent of the state’s voters, was challenged by two trade groups that said it interfered with interstate commerce and sound business practices.“Almost no sow farmers in the country satisfy Proposition 12’s sow housing requirements, and most believe that those requirements would harm their animals, employees and operations,” lawyers for the two groups — the National Pork Producers Council and the American Farm Bureau Federation — told the justices in their petition seeking review.In a brief urging the justices to reject the trade groups’ appeal, Rob Bonta, California’s attorney general, said his state was entitled to regulate sales there, adding that the law “is entirely indifferent to the ways products sold in other states are priced or produced.”AdvertisementContinue reading the main storyHe added that “a number of pork producers and suppliers have publicly announced that they have taken steps to ensure that their products will continue to be sold lawfully in California.” Those suppliers include Tyson and Hormel, Mr. Bonta wrote in his brief in the case, National Pork Producers Council v. Ross, No. 21-468.Lawyers for the Humane Society of the United States and other animal welfare groups, which intervened in the case to defend the law, wrote that it was meant to end “cruel and unsanitary conditions that threaten the health of California consumers” and that “producers can freely sell products outside California from farm animals confined contrary to Proposition 12’s standards.”A unanimous three-judge panel of the U.S. Court of Appeals for the Ninth Circuit, in San Francisco, rejected the argument that the law’s out-of-state effects made it invalid. “State laws that regulate only conduct in the state, including the sale of products in the state, do not have impermissible extraterritorial effects,” Judge Sandra S. Ikuta wrote for the panel.The law forbids the sale of most pork in California unless the pig it comes from was born to a sow that was housed with 24 square feet of space. But most sows around the nation are kept in much smaller enclosures.“These pens,” the groups challenging the California law wrote, “provide around 14 square feet of space and — for hygiene, safety, and animal-welfare and husbandry reasons — do not allow the sow to turn around.”AdvertisementContinue reading the main storyThe size of California’s market, the groups added, makes it impossible to ignore the state’s requirements. “Californians account for 13 percent of the nation’s pork consumption, but raise hardly any pigs,” their brief said. “The massive costs of complying with Proposition 12 fall almost exclusively on out-of-state farmers.”Since California imports almost all the pork sold in the state, they said, the law as a practical matter seeks to regulate producers in places like Minnesota and Iowa.","null"
