web-scraper-order,web-scraper-start-url,nytimes,nytimes-href,headline,date,author,article
"1648571383-1213","https://www.nytimes.com/section/us","DeSantis Signs Florida Bill That Opponents Call ‘Don’t Say Gay’","https://www.nytimes.com/2022/03/28/us/desantis-florida-dont-say-gay-bill.html","DeSantis Signs Florida Bill That Opponents Call ‘Don’t Say Gay’","March 28, 2022","Patricia Mazzei","MIAMI — Gov. Ron DeSantis of Florida signed legislation on Monday that prohibits classroom instruction and discussion about sexual orientation and gender identity in some elementary school grades, a law that opponents have called “Don’t Say Gay.”“We will make sure that parents can send their kids to school to get an education, not an indoctrination,” Mr. DeSantis, a Republican, said from a classroom at a charter school in Spring Hill, Fla., north of Tampa.The law, titled “Parental Rights in Education,” has drawn national criticism from L.G.B.T.Q. organizations that fear it will have a chilling effect among teachers and young students.Workers at Disney, one of the state’s major employers and corporate political donors, staged walkouts in protest after the bill passed the Legislature, even after the company’s chief executive had apologized to employees for not taking a stronger stand against the legislation and paused contributions to political campaigns.  On Monday, Disney released a statement condemning the new law and urging lawmakers to repeal it or the courts to strike it down. AdvertisementContinue reading the main storyOn Sunday night, the Oscar hosts Amy Schumer, Regina Hall and Wanda Sykes chanted “gay, gay, gay,” in a nod to the Florida legislation. President Biden called the proposal “hateful.”“DeSantis is attempting to censor and exclude an entire community of people from our public schools for his own political gain,” State Representative Carlos Guillermo Smith, an Orlando Democrat and the state’s first openly gay Latino lawmaker, said in a statement. “This law doesn’t solve any problem that exists.”The uproar did little to move the governor or lawmakers in the Republican-controlled Legislature, who spent much of their annual session passing legislation to put Florida at the forefront of the nation’s culture wars, including a 15-week abortion ban, while avoiding pressing issues such as the state’s lack of affordable housing and shaky insurance market.If anything, the opposition from progressive activists, corporate boardrooms and A-list stars made Mr. DeSantis, who faces re-election in November and clearly harbors presidential ambitions, more of a warrior figure to his political base.“If those are the types of people that are opposing us on parents’ rights, I wear that like a badge of honor,” he said at the bill signing. “I don’t care what corporate media outlets say, I don’t care what Hollywood says, I don’t care what big corporations say. Here I stand. I’m not backing down.”AdvertisementContinue reading the main storyHe spoke behind a lectern with a campaign-style sign in front reading, “PROTECT CHILDREN SUPPORT PARENTS,” and held up posters showing what he said were examples of teaching materials found in some Florida schools, including an apparent page from a picture book about a transgender boy.Mr. DeSantis argued that the law is a popular, common-sense measure limited in scope to the school curriculum. He blasted critics for what he said was willfully misinterpreting its provisions, though some of the language in the law is vague and subject to interpretation.“They’re doing it because they actually support having woke gender ideology in the first grade,” the governor said.The law could have far-reaching implications to children in other grades and without any connection to L.G.B.T.Q. issues. It will allow parents to opt out of counseling and mental health services and to sue school districts for any perceived violations. Districts will have to cover the costs of those lawsuits."
"1648571365-1201","https://www.nytimes.com/section/us","Biden Administration Will Start Vaccinating Migrants at BorderSome migrants who refuse will be detained and placed in removal proceedings, according to directions given to homeland security officials.By Eileen Sullivan","https://www.nytimes.com/2022/03/28/us/politics/vaccines-migrants-border.html","Biden Administration Will Start Vaccinating Migrants at Border","March 28, 2022","Eileen Sullivan","WASHINGTON — The Biden administration is requiring coronavirus vaccines for some undocumented migrants at the southwest border, a policy change that comes days before the administration’s next review of a public health order that has limited immigration during the pandemic.Under the plan, officials will start vaccinating undocumented migrants without proof of vaccination who are apprehended by border officials, but not expelled under the public health order, in seven areas including San Diego, El Paso and the Rio Grande Valley. A description of the plan was shared with The New York Times.According to directions given to senior homeland security officials on Sunday, if single adults refuse to be vaccinated, they will be detained and put into deportation proceedings. If they request asylum and cannot remain in detention, they will be released with a monitoring device “with stringent conditions.” If migrant families refuse vaccination, they will also be given monitoring devices with the same conditions.The White House has said little about whether it will soon lift the public health order, which the Trump administration put in place at the start of the pandemic. The order, known as Title 42, gives border officials the authority to turn back migrants seeking to enter the United States so that they do not spread the coronavirus here, a precaution that public health experts have called unnecessary.AdvertisementContinue reading the main storyThe Centers for Disease Control and Prevention is supposed to review whether the rule is still necessary at this stage in the pandemic, and issue a decision in the coming days.The administration’s decision to start vaccinating some undocumented migrants appears to be an acknowledgment that there are measures other than the public health order that can be taken to minimize the spread of the coronavirus across borders. A Department of Homeland Security spokesman said vaccinating immigrants in the department’s custody is a “public health best practice.” The spokesman did not explain why the department had waited so long to put that practice in place with regard to undocumented migrants, many of whom come from Central America. Planning for these vaccinations has been in the works. In November, the administration put out a request for a short-term contract to provide Covid-19 vaccinations at points along the southwest border.Previously, the administration has resisted vaccinating undocumented immigrants, despite multiple proposals from the Department of Homeland Security over the past year on how to do it. President Biden’s domestic policy adviser, Susan Rice, has privately raised concerns that it would provide an incentive for more undocumented migrants to try to cross the border, according to three current and former government officials with knowledge of the ongoing discussions, who spoke on condition of anonymity to discuss internal deliberations.Noah Gottschalk, the global policy lead at Oxfam America, said that argument makes little sense.“Based on our work in the regions and places that people are coming from, that would have absolutely nothing to do with people coming,” he said. “People have access to vaccines. They are coming because they’re fleeing persecution.”AdvertisementContinue reading the main storyInside the Homeland Security Department, officials have been planning for Title 42 to end in early April. They expect large crowds of migrants as a result, exceeding the already-high numbers that have been crossing without documentation in recent weeks.The Coronavirus Pandemic: Latest UpdatesUpdated March 29, 2022, 10:41 a.m. ET2 hours ago2 hours agoThe F.D.A. authorizes second Covid booster shots for those 50 and older, and some immunocompromised people.Here’s how Shanghai’s lockdown is testing China’s ‘Covid-zero’ policy, and people’s limits.Experts warn of racial disparities in the diagnosis and treatment of long Covid.Since President Biden has been in office, there has been a significant spike in the number of migrants crossing the southwest border, many fleeing poverty and persecution. The administration has used the public health rule to expel migrants a little more than half of the time, allowing in others with humanitarian exemptions.Migrant children who arrive at the border without a parent or guardian have been exempted from the rule and allowed to enter. The administration has been offering vaccinations to eligible migrant children in government shelters for months; Immigration and Customs Enforcement has also been offering vaccinations to immigrants in detention. And the administration has been vaccinating asylum-seeking migrants who are waiting in Mexico until the United States makes a decision on their case.Amesh Adalja, a senior scholar at the Johns Hopkins Center for Health Security, said vaccinations should have been offered to all undocumented migrants apprehended on American soil.“There’s no actually valid argument to not vaccinate people at the border, especially when our vaccination rates are the lowest that they’ve been in the United States and we’re actually throwing vaccine in the trash,” Dr. Adalja said. “If they don’t do this, they would rather put vaccine in the trash can than put it into a migrant’s arm, is basically what that amounts to.”Critics of the order say it is being used to control the influx of undocumented migrants. The Biden administration, which has relied heavily on scientific evidence to justify many other health precautions during the pandemic, has not produced data that shows undocumented migrants play a significant role in spreading the coronavirus.In a ruling regarding the use of the policy, a panel of judges on the U.S. Court of Appeals for the District of Columbia Circuit noted the lack of data.AdvertisementContinue reading the main story“We are not cavalier about the risks of Covid-19. And we would be sensitive to declarations in the record by C.D.C. officials testifying to the efficacy” of the public health order, the panel wrote earlier this month. “But there are none.”They added: “From a public-health perspective, based on the limited record before us, it’s far from clear that the C.D.C.’s order serves any purpose.”The White House and Homeland Security Department have consistently said the public health order is issued at the sole discretion of the Centers for Disease Control and Prevention.“It is not a matter of immigration policy,” Alejandro N. Mayorkas, the Homeland Security secretary, said on March 17. The C.D.C. determines the order’s necessity, he said, “on a public health basis, depending on where we are in the arc of the Covid-19 pandemic.”Mr. Mayorkas pointed to the spread of variants in other countries. While Covid case numbers are falling in most of the United States, an Omicron subvariant, BA.2, is fueling an increase in cases in Europe and could cause another surge here, although it does not appear to be causing widespread severe illness.The administration has been fighting in court to keep the public health order in place for migrant families, even though many are already exempted from it. The same appeals panel that noted earlier this month that the C.D.C. had not presented any evidence justifying the order also ruled that the administration could not use it to expel families to countries where they would face persecution or torture.Lawyers were supposed to file a status update last week, but instead asked for an extension until after the C.D.C. decides whether to keep the rule in place.Zolan Kanno-Youngs contributed reporting."
"1648571390-1215","https://www.nytimes.com/section/us","After Mass Shooting, a Town in Arkansas Struggles to Move Forward","https://www.nytimes.com/2022/03/29/us/dumas-arkansas-hood-nic-shooting.html","After Mass Shooting, a Town in Arkansas Struggles to Move Forward","March 29, 2022, 3:00 a.m. ET","Richard Fausset","DUMAS, Ark. — The small city of empty storefronts and vacant lots that is Dumas, Ark., has seen its population drain away steadily over the decades. But each spring, people of the diaspora have made their way along two-lane country roads, driving through cotton fields and catfish farms and finally  into Dumas for Hood-Nic, the community’s big “neighborhood picnic,” which serves as an informal homecoming.It is typically a low-key day full of preachers, rappers, raffles, food trucks and a contest for custom-car owners. The event raises money for scholarships and promotes nonviolence. But this year, organizer Sylvester Spinks Jr. said, something “allowed the devil to slide in.”An evening eruption of gunfire in a crowd of roughly 1,500 people at the Hood-Nic festival on March 19 resulted in the largest mass shooting in the United States this year, leaving a 23-year-old man dead and 26 other people wounded, including five children. Last week, authorities arrested Brandon D. Knight, 22, a North Little Rock man who, according to a police affidavit, admitted to firing a handgun at a man who he said had robbed and shot an acquaintance that day.ImageA Saturday evening  eruption of gunfire in a crowd of roughly 1,500 people at the Hood-Nic festival resulted in the largest mass shooting in the United States so far this year.Credit...Rory Doyle for The New York TimesAdvertisementContinue reading the main storyImageIn Dumas, Hood-Nic is the city’s big “neighborhood picnic,” serving as an informal homecoming.Credit...Rory Doyle for The New York TimesThe police found 17 spent shell casings that they said were compatible with a .40 caliber Glock handgun belonging to to Mr. Knight. But Arkansas state police have not fully explained what happened, and said their investigation was ongoing.In the days that followed, bandaged victims trickled home from hospitals, and the parking lot of the shuttered discount store where the event was held was cleaned of bloodstains. Dumas, a city of 4,000 people 90 miles southeast of Little Rock, seemed united in anger and grief: Nearly everyone in town seemed to have some connection to the families of the wounded.And there was grave concern that another victim of gun violence could be Hood-Nic itself, a grass-roots event that has united scattered friends and family for years and served as a bright spot in a place of grinding poverty and diminished opportunities.“It got bigger and bigger every year,” Curtis Allen, 68, a retired trucker, said of Hood-Nic. But after the shooting, Mr. Allen said, “I know a lot of folks are going to say they aren’t going to go to another one of those things.”AdvertisementContinue reading the main storyThe solutions proposed for Hood-Nic, and for Dumas, reflect the priorities and anxieties of a nation that is reeling from what recent data suggests is a 30 percent rise in murders since 2019. Some residents wondered if metal detectors and surveillance cameras would help. The Rev. Arthur L. Hunt Jr., a local activist, said the underlying social problems could be ameliorated by his pet project — a proposed multimillion-dollar arts and technology college.Guns and Gun Control in the U.S.The Children's Gun Crisis: More kids are becoming both victims and shooters, as pandemic trauma and a surge in gun purchases collide.Ominous Harbinger: The surge in gun violence showed no sign of easing with the arrival of spring, with several shootings in one single weekend.A Landmark Case: The Supreme Court is poised to issue its first major Second Amendment ruling in more than a decade — and the implications could be enormous.Suing Gun Makers: Remingtom’s settlement with Sandy Hook families shows how a federal law shielding the gun industry from litigation can be circumvented.Flora J. Simon, the mayor of Dumas, said she was not sure if anything could be done to prevent another shootout. “If two people want to fight, I don’t care how many people, how many teachers you’ve got on duty on the playground,” said Ms. Simon, a retired high school science teacher. “They can be sitting there having a nice conversation, all of a sudden they jump up — and they fight.”ImageDumas, a majority-Black city of 4,000 people, seemed united in anger and grief. Nearly everyone in town seemed to have some connection to the families of the wounded.Credit...Rory Doyle for The New York TimesImageCommunity members gather for a prayer vigil in Dumas, Ark., on March 20.Credit...Rory Doyle for The New York TimesArkansas has some of the most permissive gun laws in the United States and is struggling with an increase in gun violence. The national gun-control group Everytown for Gun Safety notes that the rate of gun deaths increased by 40 percent in the state in the last decade, compared to 33 percent nationwide.The recent political climate has favored loosening gun restrictions even further. Last year, the Republican-controlled State Legislature passed a law that allows residents to carry concealed weapons without a permit. Mr. Knight told the police he had kept his handgun in his waistband. He was arrested on suspicion of battery and aggravated assault, but has not been accused of violating any weapons possession laws.The Hood-Nic festival began in 2004, an attempt to build something positive in a community that was already shrinking dramatically, as farms grew increasingly mechanized and companies moved overseas. Mr. Spinks and a group of friends built on an existing front-yard barbecue and added rap performances and other attractions.AdvertisementContinue reading the main story“At that time, there was a lot of crime going on,” said Jesse Webb, an organizer who was living in Ohio at the time. “And you’ve got to realize, this is a very small place. Anytime we would call home, something bad had happened. Somebody got killed. Somebody was robbing a bank. It was just all kind of crazy stuff.”The challenges facing Dumas, the largest city in Desha County, are common in the flat, fertile Arkansas Delta region. The county population plummeted from roughly 20,000 people in 1980 to about 11,400 in 2020, according to census figures. Poverty stands at 22.8 percent — twice the national average. Dumas once boasted two new car dealerships and a Walmart, but all are gone now. The Walmart was replaced by an outpost of a regional discount chain, Fred’s, which declared bankruptcy in 2019. Its broad expanse of empty asphalt served as a convenient setting for this year’s Hood-Nic.Image Jesse Webb helped to start Hood-Nic in 2004, building on an existing front-yard barbecue and adding rap performances by himself and others.Credit...Rory Doyle for The New York TimesImageThe population of Dumas and the surrounding Desha County has been shrinking for decades.Credit...Rory Doyle for The New York TimesThe legacy of segregation in the majority-Black city remains palpable. In Dumas, train tracks separate what are still considered Black and white sides of town, although those distinctions have blurred over the years. Mayor Simon is the first African American elected to the job. Hood-Nic has been notable as a popular community event started by Black organizers. This year, an added sense of anticipation preceded Hood-Nic; the event had been canceled the two previous years because of the pandemic. Cars jammed U.S. Highway 65 on either side of the dollar-store parking lot. Chris Jones, a Democratic candidate for governor, showed up around noon to campaign. He set up a booth, registering voters among the custom cars and farmers on horseback.Mr. Jones left before the shooting began. But Mr. Webb was onstage. “It looked like fireworks,” he said. “I saw light flashing on the ground. I was in disbelief, like, who would set some firecrackers in the crowd? From there it was just a melee. It was just disgusting.”AdvertisementContinue reading the main storyThe Rev. Roscoe Joyner, 73, was in a McDonald’s with a view of the crowd when the shooting started. His 10-year-old grandson was out there somewhere. Rev. Joyner went running outside, terrified. “There was a crowd of people, they stampeded toward me. I had to push through.”ImageThe Rev. Roscoe Joyner, 73, was in a McDonald’s with a view of the crowd when the shooting started. Credit...Rory Doyle for The New York TimesImageEmergency tape remained in the parking lot of the scene of the shooting in Dumas, Ark.Credit...Rory Doyle for The New York TimesHe came across children who were bleeding. One, a girl who seemed to be younger than 10, had been shot in the leg and was hopping. A little boy was being carried in someone’s arms. He saw the man who was killed, Cameron Shaffer, 23, lying motionless on the pavement.Moments later he found his grandson, who was paralyzed with fear. A stranger had pushed the boy behind a car to shield him. Soon, Rev. Joyner said, another round of gunfire rang out.According to the affidavit, Mr. Knight, the accused gunman, told the police he was shot in the chest and the arm by the man who had tried to rob his friend. He was hospitalized, and arrested upon release. Another injured person had identified him while he was on a gurney.Mr. Knight also told the police he did not know how many times he fired after pulling his handgun from his waistband. He told them it had all happened so fast that his adrenaline was pumping.AdvertisementContinue reading the main story“I know there was a lot of kids out there,” he told them, according to the affidavit. When he saw the young people in the hospital, he said, “it hurt.”A few days later, Mayor Simon shared details about available trauma counselors in the local newspaper. Rev. Hunt wrote an essay encouraging residents to “pray without ceasing.”Mr. Jones, the candidate for governor, came to town Friday and spoke at a sparsely attended news conference, noting that he was one of many responsible Arkansas gun owners. “It’s time for a balanced conversation on gun violence,” he said. Later, he told a reporter that the conversation should include revisiting “open-carry” and other Arkansas gun laws.Mr. Webb and Mr. Spinks, the Hood-Nic co-founders, said it was too early to say what would become of their festival. Their focus for now, they said, was on raising funds for victims.“This has always been about the kids,” Mr. Webb said, “and a lot of the kids are still traumatized.”"
