web-scraper-order,web-scraper-start-url,nytimes,nytimes-href,headline,date,author,article
"1648571341-1184","https://www.nytimes.com/section/us","Local Election Officials in Georgia Oppose G.O.P. Election BillAs Republicans rush to pass a second round of new voting and election rules, a bipartisan group of election officials is fighting back.By Maya King and Nick Corasaniti","https://www.nytimes.com/2022/03/28/us/politics/georgia-election-bill.html","Local Election Officials in Georgia Oppose G.O.P. Election Bill","Published March 28, 2022Updated March 29, 2022, 12:28 a.m. ET","Maya King","ATLANTA — A year ago, when Georgia Republicans passed a mammoth law of election measures and voting restrictions, many local election officials felt frustrated and sidelined, as their concerns about resources, ballot access and implementation went largely ignored.This year, Republicans have returned with a new bill — and the election officials are pushing back.A bipartisan coalition of county-level election administrators — the people who carry out the day-to-day work of running elections — is speaking out against the latest Republican measure. At a legislative hearing on Monday, they warned that the proposal would create additional burdens on a dwindling force of election workers and that the provisions could lead to more voter intimidation.“You’re going to waste time, and you’re going to cause me to lose poll workers,” said Joel Natt, a Republican member of the Forsyth County board of elections, referring to a provision in the bill that he said would force workers to count hundreds of blank sheets of paper. “I have 400 poll workers that work for our board. That is 400 people that I could see telling me after May, ‘Have a nice life,’ and it’s hard enough to keep them right now.”Among other provisions, the bill would expand the reach of the Georgia Bureau of Investigation over election crimes; limit private funding of elections; empower partisan poll watchers; and establish new requirements for tracking absentee ballots as they are verified and counted.AdvertisementContinue reading the main storyThe bill passed the Georgia House this month, roughly two weeks after it was first introduced. Initially, the State Senate appeared set to pass the measure at a similar speed. The state’s legislative session ends on April 4, giving lawmakers less than a week to pass the bill.But county-level election officials worked behind the scenes, in letters and phone calls to legislators, expressing their concerns about the bill and dissatisfaction that they had not been consulted in the drafting process.The pushback comes as the impact of the wave of election laws passed by Republicans last year is beginning to be felt. In Texas, where a new law altered the absentee ballot process, election officials dealt with widespread confusion among absentee voters in the March primary. Mail ballot rejections surged, and county officials worked around the clock to help voters fix their ballots. Still, more than 18,000 voters had their ballots tossed out.The vocal opposition from Georgia election officials represents a shift from a year ago, when some individual officials, mostly Democrats, spoke out against the first Republican bill. But many local officials simply felt ignored by lawmakers who were eager to appear to be addressing Republican voters’ false beliefs about fraud in the 2020 election.The statewide association of local election officials is now working to “start taking stances on legislation like this, where the association would have a view that represents a majority of our members,” said Joseph Kirk, the elections supervisor for Bartow County, which is deeply Republican, who serves as a secretary for the association. He added that the group had not taken a stance on the election bill but that many members were voicing their opinions individually.AdvertisementContinue reading the main storyAt a conference this month, Ryan Germany, general counsel for Secretary of State Brad Raffensperger, encouraged members to speak up.“They really need to know what you guys think about this stuff because they hear from a lot of people, but I don’t think they hear from a lot of election officials,” said Mr. Germany, who spoke favorably about several provisions in the bill, according to audio of the event obtained by The New York Times.Dozens of voting rights advocates and county election officials crowded the State Senate Ethics Committee hearing on Monday afternoon, saying the bill would make it harder for election administrators to do their jobs.ImageFrom left, State Senators Sally Harrell, Butch Miller and Jeff Mullis listened as Cindy Battles, right, testified during the hearing on Monday. Credit...Nicole Craine for The New York Times“There are so many unfunded mandates being passed by this body. You are not giving county election officials the budget that they need to run their elections,” said Cindy Battles, the policy and engagement director at the Georgia Coalition for the People’s Agenda, a civil rights group. “And then you are making it more difficult to get what they need.”Several officials pointed to a provision that would require elections administrators to account for all elections-related documents, including the pieces of paper that ballots are printed on. Mr. Natt, the vice chair of elections for Forsyth County’s board of elections, held up a ream of paper to represent one of the hundreds of blank sheets of paper that his office would need to count under the law.“That is a lot of counting. That is a lot of time and waste management,” he said.State Representative James Burchett, a Republican from southeastern Georgia and sponsor of the bill, did not immediately respond to requests for comment. He told The Atlanta Journal-Constitution this month that “the intent of the bill is to address issues that we’ve seen in the elections process.”AdvertisementContinue reading the main storyDuring the hearing on Monday, State Senator Butch Miller, a Republican and member of the State Senate Ethics Committee, appeared to consider some of the officials’ concerns.“I think we’ll probably have additional work to be done,” he said. While Mr. Miller said he was not interested in sweeping changes to the bill, he also said he was not opposed to “tweaking them and accommodating certain issues.” The committee has not yet scheduled a vote on the bill.Election officials warned about language they considered too broad in a provision that restricts third-party donations to election offices. The proposal is popular among Republicans who believe grants from an organization tied to Mark Zuckerberg, the chief executive of Meta, had undue influence in the 2020 election. Some Georgia election officials said the legislation would require any organization that makes a donation to receive approval from the state board of elections. That could include churches or other local groups that offer their buildings as polling locations.“By a strict interpretation of this particular provision, that would be a grant of gift or donation,” Milton Kidd, the elections director in Douglas County, a deeply Democratic county, said in an interview.Mr. Kidd added that many churches did not have staff to handle the application process, which could threaten his ability to maintain enough polling locations.Officials also took issue with a provision requiring partisan poll watchers to be given “meaningful access” to observe the ballot-counting process. The language might jeopardize the privacy of the ballot, they said.“I am a big fan of poll watchers, of being observed, I want my polling places to have observation, it’s a very important part of the process,” said Mr. Kirk, the administrator in Bartow County, which is northwest of Atlanta. “But it’s also very important to have guardrails on that observation, to keep it from becoming disruptive, to make sure a person’s information stays safe.”AdvertisementContinue reading the main storyA provision that gives the Georgia Bureau of Investigation the power to subpoena election records for fraud investigations has also stirred opposition, mostly among Democratic local officials, who view it as both unnecessary — the secretary of state’s office currently handles election investigations — and intended to scare off voters.“That just smacks of voter intimidation,” said Dele Lowman Smith, the chair of the DeKalb County board of voter registration and elections. “And that’s a big concern.”"
"1648571359-1198","https://www.nytimes.com/section/us","‘I Make No Apologies’: Biden Says His Putin Comments Were an Expression of Moral OutragePresident Biden said his words, delivered in a speech over the weekend in Warsaw, were not a call for regime change in Russia.By Michael D. Shear","https://www.nytimes.com/2022/03/28/us/politics/biden-putin.html","‘I Make No Apologies’: Biden Says His Putin Comments Were an Expression of Moral Outrage","March 28, 2022","Michael D. Shear","WASHINGTON — President Biden on Monday stood by his comment that Vladimir V. Putin should not remain president of Russia, but he said it was an expression of his own horror over the invasion of Ukraine and not a change in American policy aimed at seeking to remove Mr. Putin from office.“I was expressing the moral outrage that I feel, and I make no apologies for it,” Mr. Biden told reporters at the White House, rejecting criticism from around the globe in the last two days about the potential diplomatic consequences of his words. The president said no one should have interpreted his comments as calling for Mr. Putin’s ouster.“It’s ridiculous,” he said of the questions about his speech in Warsaw on Saturday, when he said, “For God’s sake, this man cannot remain in power.” On Monday, Mr. Biden said: “Nobody believes I was talking about taking down Putin. Nobody believes that.”The fallout over Mr. Biden’s words in Warsaw underscored the dilemma that he and the NATO allies face about how to condemn the war in Ukraine and pressure Russia without shutting down any relationship with Moscow that might help end the invasion.AdvertisementContinue reading the main storyThe West will also have to decide whether Moscow would be allowed back into the global economy, whether to lift sanctions and how to resume diplomatic relations if Russia pulls back its forces.Mr. Biden’s remark drew some praise for its toughness and clarity but also warnings from lawmakers and President Emmanuel Macron of France, who said on Sunday that “I wouldn’t use this kind of words” when asked about Mr. Biden’s speech. Mr. Macron said he hoped to obtain a cease-fire and the withdrawal of Russian troops from Ukraine through diplomacy.Some critics said Mr. Biden’s declaration could make it more difficult to negotiate an end to the 5-week-old war, which has killed thousands in Ukraine and driven millions from their homes.Mr. Biden insisted on Monday that was not the case, although Mr. Putin has told Russians for years that he believes the United States and the C.I.A. are conspiring to remove him from power. Dmitri S. Peskov, the Kremlin’s spokesman, said that Mr. Biden’s statement “makes us worry” and that the Kremlin would “continue to closely monitor” the president’s remarks.ImagePresident Vladimir V. Putin has told Russians for years that he believes the United States and the C.I.A. are conspiring to remove him from power.Credit...Sputnik, via ReutersIn his speech in Warsaw, Mr. Biden tried to draw a distinction between Mr. Putin’s actions and those of the Russian people, who he said were not responsible for the atrocities being committed by the country’s military in Ukraine each day. He suggested that Russian controls on television and the internet had left the country’s citizens unaware of the truth.AdvertisementContinue reading the main story“Vladimir Putin’s aggression have cut you, the Russian people, off from the rest of the world, and it’s taking Russia back to the 19th century,” he said. Moments later, he proclaimed that “a dictator bent on rebuilding an empire will never erase a people’s love for liberty” before declaring that Mr. Putin should go.The White House appeared to rapidly understand that Mr. Biden’s words could be seen as a reversal of the administration’s long-stated position that it was not seeking regime change in Russia. It took just minutes for officials to back away from Mr. Biden’s comments on Saturday evening. Reporters had just loaded buses after his speech when administration officials sent an email denying that the president was formally advocating Mr. Putin’s removal.On Sunday, Secretary of State Antony J. Blinken told journalists in Jerusalem that “we do not have a strategy of regime change in Russia or anywhere else, for that matter.”On Monday, his first extended comments on the matter, Mr. Biden insisted his statement had been misinterpreted.Live Updates: Russia-Ukraine WarUpdated March 29, 2022, 7:01 a.m. ET5 hours ago5 hours agoTalks in Turkey focus on a possible cease-fire.The head of the U.N. nuclear agency arrives in Ukraine to address security at nuclear sites.A Russian attack leaves a gaping hole in a government building in Mykolaiv.“The last thing I want to do is engage in a land war or a nuclear war with Russia. That’s not part of it,” Mr. Biden said. “I was expressing my outrage at the behavior of this man. It’s outrageous. It’s outrageous. It’s more an aspiration than anything. He shouldn’t be in power.”AdvertisementContinue reading the main story“People like this shouldn’t be ruling countries, but they do,” he said, adding, “But it doesn’t mean I can’t express my outrage.”Mr. Biden spoke as the violence in Ukraine continued to intensify, with Russian forces appearing determined to cement their territorial gains in the east. In just five weeks, the conflict has killed thousands of civilians, including women and children who have been the victims of intense Russian bombardment. Human rights advocates say more than 3.7 million Ukrainians have fled, creating one of the largest-ever refugee crises across Eastern Europe.The president’s remark on Saturday was not the first time an apparently off-the-cuff comment upended or overshadowed an otherwise tightly scripted White House message.During a news conference earlier on the trip, Mr. Biden said Russia’s use of chemical weapons “would trigger a response in kind,” seeming to suggest that NATO would respond with chemical weapons, which are banned by international law. Jake Sullivan, the president’s national security adviser, told reporters the next day that was not what the president meant, saying that the “United States has no intention of using chemical weapons, period, under any circumstances.”In January, Mr. Biden created a similar flurry of speculation when he said that the response to a then-potential invasion of Ukraine would depend on whether “it’s a minor incursion.” Mr. Biden eventually corrected himself, saying, “If any, any assembled Russian units move across the Ukrainian border, that is an invasion.”ImageBefore his speech on Saturday, President Biden visited with refugees from Ukraine at a stadium in Warsaw.Credit...Doug Mills/The New York TimesMr. Biden is no stranger to the nuances of public diplomacy, in which officials — especially heads of state — are careful to speak in very particular ways in an effort to avoid offending another leader or sending an unintended message about policy.AdvertisementContinue reading the main storyAmerican presidents, for example, never refer to Taiwan as an independent nation for fear of provoking anger from the Chinese government. Similar care is taken when talking about the city of Jerusalem, the status of which remains a disputed part of discussions between Israel and the Palestinians.In 2016, when President Barack Obama delivered a eulogy at the funeral of Shimon Peres, the former Israeli president, a White House stenographer initially indicated that the remarks had been given in “Jerusalem, Israel.” After that created a minor flap, the remarks were amended to remove the reference to Israel.President Donald J. Trump repeatedly violated many of the diplomatic rules in what aides said was a deliberate attempt to shake up the way foreign policy was conducted. He called the leader of North Korea “Rocket Man,” formally recognized Jerusalem as the capital of Israel and took steps to more formally deal with Taiwan in the final days of his administration.Since taking office, Mr. Biden has made it a priority to return to a more traditional form of diplomacy in which the United States seeks to work with adversaries like Russia even as the administration challenges actions by Mr. Putin that it finds objectionable.But Russia’s invasion of Ukraine has tested that approach. During the past several weeks, Mr. Biden has grown increasingly vocal in his condemnation of Mr. Putin, using more aggressive language as the Russian leader has escalated his attacks on Ukraine.A week ago, he called Mr. Putin “a war criminal” before the United States had officially made that determination. Before his speech on Saturday, Mr. Biden visited with refugees from Ukraine at a stadium in Warsaw and called Mr. Putin “a butcher” because of the deaths caused by shelling in Mariupol, a hard-hit city in the eastern part of the country.That kind of language has helped Mr. Biden unite American allies behind a coordinated set of responses to Mr. Putin’s aggression, including some of the most severe sanctions ever levied on a large, developed nation. The president’s condemnations have been echoed over the past several weeks by other world leaders.AdvertisementContinue reading the main storyBut it remains a delicate balance as the administration tries not to provoke Mr. Putin into engaging in a broader conflict with NATO countries. Mr. Biden has said repeatedly that such engagements could lead to World War III.In his remarks to reporters on Monday, the president said it was his visit with the refugees just hours earlier that led to his comment about Mr. Putin not staying in power.“Half the children in Ukraine,” he said, apparently referring to the number of children who are estimated to have become refugees because of the war. “I had just come from being with those families.”"
"1648571353-1194","https://www.nytimes.com/section/us","TimesVideoPennsylvania Snow Squall Causes Highway PileupSudden and blinding snow caused at least 50 vehicles to crash on Interstate 81 northeast of Harrisburg, Pa. About 20 people were taken to hospitals, the authorities said.By Reuters and The Associated Press","https://www.nytimes.com/video/us/100000008277227/snow-pennsylvania-highway-crash.html","Pennsylvania Snow Squall Causes Highway PileupPennsylvania Snow Squall Causes Highway Pileup","null","null","null"
"1648571329-1175","https://www.nytimes.com/section/us","TimesVideoBiden Unveils 2023 BudgetPresident Biden proposed a $5.8 trillion budget, which included additional military spending in the face of Russia’s invasion of Ukraine, domestic funding for police departments and new taxes on the wealthiest Americans.By The New York Times","https://www.nytimes.com/video/us/politics/100000008277005/biden-budget-2023.html","Biden Unveils 2023 BudgetBiden Unveils 2023 Budget","null","null","null"
"1648571376-1209","https://www.nytimes.com/section/us","Some States Suspend Their Gas Taxes, Looking to Ease Pain at the Pump","https://www.nytimes.com/2022/03/27/us/gas-tax-cuts.html","Some States Suspend Their Gas Taxes, Looking to Ease Pain at the Pump","March 27, 2022","Giulia Heyward","Seeking to soften the blow of higher gas prices on consumers, a handful of states have suspended their gas taxes, and several other states may soon follow.Gas prices, which had already been climbing during the pandemic, rose to new highs in recent weeks in part because the war in Ukraine led to more volatility in the energy market. The average cost of gas in the United States hit a record high on March 11 at $4.33 per gallon, according to AAA. Although that number has since declined to an average of $4.24 per gallon, it is still 18 percent higher than it was last month and 48 percent more than it was a year ago.Some states are using budget surpluses from federal pandemic aid and increased tax revenue to cover the cost of suspending gas taxes for the next several weeks or months. Others are also considering pausing fares for public transportation.On March 18, Gov. Larry Hogan of Maryland announced that the state would suspend its tax of 36.1 cents per gallon for gasoline, and its slightly higher tax for diesel fuel, for the next 30 days, a measure that will cost the state $100 million.AdvertisementContinue reading the main story“As we continue to stand in solidarity against Russian aggression in Ukraine, and as Marylanders face the impact of surging inflation, with the average price of gas rapidly rising, this bipartisan action will provide some relief for the pain at the pump,” Mr. Hogan said as he signed the bill into law.That same day, Gov. Brian Kemp of Georgia signed a bill suspending the state’s gas tax until May 31. On March 24, Gov. Ned Lamont of Connecticut announced that his state would temporarily suspended the 25 cents per gallon excise tax — as well as fares needed to ride a public bus — from April 1 to June 30.Officials in other states are considering similar measures.In Ohio, where gas prices have risen 21 percent over the past month, Republican lawmakers are considering a gas tax cut that would cost up to $4 billion over the next five years. Live Updates: Russia-Ukraine WarUpdated March 29, 2022, 7:01 a.m. ET5 hours ago5 hours agoTalks in Turkey focus on a possible cease-fire.The head of the U.N. nuclear agency arrives in Ukraine to address security at nuclear sites.A Russian attack leaves a gaping hole in a government building in Mykolaiv.In West Virginia, a group of Democratic lawmakers is calling on the governor to suspend gas prices for the next month. And in California, Gov. Gavin Newsom proposed an $11 billion relief package that would pause the state’s gas tax and provide free public transportation to residents.The average price of gas in California is $5.91, one of the highest in the country, compared with $4.82 a month ago, according to AAA. Mr. Newsom said the state needed to respond because of the price spikes that he said stemmed from the actions of President Vladimir V. Putin of Russia.AdvertisementContinue reading the main story“We’re taking immediate action to get money directly into the pockets of Californians who are facing higher gas prices as a direct result of Putin’s invasion of Ukraine,” Mr. Newson said in a news release.Russia-Ukraine War: Key DevelopmentsCard 1 of 3The status of peace talks. President Volodymyr Zelensky said in an interview with Russian journalists that Ukraine was “ready” to discuss a neutral geopolitical status but insisted that he would not cede sovereignty. Ukrainian and Russian diplomats are planning to meet in Turkey.On the ground. As the war entered its fifth week, Ukrainian forces appeared to make gains in the northeast. Despite talk of Russia focusing on the east, fighting across multiple battlefronts, including in the southern city of Mariupol, suggested a more dynamic and volatile situation.Biden’s comments. During a speech in Warsaw on Saturday, President Biden said that President Vladimir V. Putin “cannot remain in power,” sending U.S. officials scrambling to walk back the ad-lib. On Monday, Mr. Biden stood by his remark, but said it was a personal expression of his outrage.But while many officials have embraced this kind of legislation, some experts say that a temporary reprieve from state gas taxes is an ill-conceived fix that will only hurt Americans in the long run.The relief could provide a respite for drivers, and help lower shipping costs for foods, but the moves do not address other people or problems affected by inflation, they argue.“This is primarily concentrated on drivers, and therefore doesn’t provide broader relief from all of the inflation-induced price increase,” said Jared Walczak, vice president of state projects at the Center for State Tax Policy, part of the nonprofit Tax Foundation.Drivers could experience sticker shock once these temporary cuts end and prices revert to normal, he added.“Even though it will provide some relief at the pump, it’s ultimately a fairly gimmicky way of providing relief at a time when consumers are facing higher prices across the board,” Mr. Walczak said."
