web-scraper-order,web-scraper-start-url,nytimes,nytimes-href,headline,date,author,article
"1648571373-1207","https://www.nytimes.com/section/us","Hillsong, Once a Leader of Christian Cool, Loses Footing in AmericaAmid a series of crises, including the resignation of its leader, the evangelical powerhouse has shed more than half its American churches in just a few weeks.By Ruth Graham","https://www.nytimes.com/2022/03/29/us/hillsong-church-scandals.html","Hillsong, Once a Leader of Christian Cool, Loses Footing in America","March 29, 2022, 5:00 a.m. ET","Ruth Graham","Terry Crist, a fifth-generation pastor in Phoenix, joined the global megachurch Hillsong in part because of what he describes as its distinctly joyful approach to church life: Hillsong was an institution where leaders seemed “light and free,” offering a church experience that attracted tens of thousands of people around the world.Starting in Phoenix, Mr. Crist eventually brought six churches in two states into the Hillsong fold. Last week, he took them out.“We cannot continue in our global family, as much as we love it,” Mr. Crist told his congregation in an emotional sermon on Sunday, citing, among other reasons, the recent resignation of Hillsong’s global leader under a haze of scandal. “I am heartbroken.”In the last two weeks, Hillsong has lost nine of its 16 American church campuses, a swift and stunning decline for one of the world’s largest and most influential evangelical churches.AdvertisementContinue reading the main storyJust a few years ago, Hillsong was the leading edge of cool Christianity, a quickly expanding network that appealed to young people and city dwellers with energetic, stylish preachers and an upbeat atmosphere. Hillsong translated the charismatic church experience, which emphasizes miracles and personal encounters with the Holy Spirit, for a hip, upscale audience.Justin Bieber and the N.B.A. star Kevin Durant attended services; one of the church’s worship bands won a Grammy Award and the church produced soaring anthems that became staples in smaller churches that imitated its sounds, style, and Instagram-friendly aesthetic.Now, Hillsong’s U.S. presence is in collapse. Its remaining U.S. locations are in the Northeast and in California, meaning Hillsong no longer has a major presence between the coasts.The departures are partly the fallout from a series of crises — most recently the sudden resignation of its charismatic founder — that have left the church with a tarnished reputation and instability that pastors say they found increasingly difficult to endure.“I can’t think of a church in the English-speaking Western world with as broad a global reach as Hillsong,” said Ed Stetzer, the executive director of the Wheaton College Billy Graham Center in Illinois. The current upheaval at the church “is a very big deal and will have ramifications not just for Hillsong, but for contemporary evangelism around the world,” he said.AdvertisementContinue reading the main storyThe church was already grappling with in-house tensions and a damaged brand when its Australian founder and global leader, Brian Houston, resigned on March 23 after an internal investigation found that he behaved inappropriately toward two women. Mr. Houston had stepped away from all ministry duties in January, explaining that he needed to concentrate on fighting a criminal charge of concealing child sexual abuse committed by his late father, who was also a pastor.ImageBrian Houston, the church’s founder, resigned in March after the church said an internal investigation found he behaved inappropriately toward two women.Credit...Jeff Gilbert/ShutterstockThe church’s investigation found that Mr. Houston sent “inappropriate text messages” to one staff member, and that several years later he spent time alone in a hotel room with a woman who attended the church’s annual conference in Sydney. In a statement to The New York Times, the press office for the church said there have been no other complaints about Mr. Houston’s behavior.The church has blamed medication and alcohol for Mr. Houston’s actions. Mr. Houston has not publicly commented on his resignation. He could not be immediately reached for comment.Phil Dooley, the church’s interim global leader, responded to some questions in an email through the church press office. In the email, Mr. Dooley said Mr. Houston’s resignation came as “a tremendous surprise to many members of our community.”  The church press office did not respond to questions about whether Mr. Houston would receive a severance package or any future financial compensation from the church. The press office also declined to say whether Mr. Houston’s wife, Bobbie, whose title was also Global Senior Pastor, remained employed by the church.On Thursday, a day after Mr. Houston’s resignation, the streaming service Discovery+ released a three-part documentary, “Hillsong: A Megachurch Exposed.” The documentary depicts the megachurch as a toxic institution obsessed with image, control and growth at all costs. It features interviews with critics, former employees and members, and a woman who has said she had a monthslong affair with Carl Lentz, at the time the celebrity lead pastor of Hillsong’s East Coast branches. The press office for the church said in an emailed statement that the documentary’s portrait of Hillsong is “almost unrecognizable” to the church community.Mr. Dooley, the interim leader, said in an email to The Times through the church press office that he has been “talking with members of our team around the world in what seems like a nonstop conversation” since the revelations of Mr. Houston’s behavior. He described the crisis as a challenging and emotional time for both members and leaders. “This difficult season has sparked conversations that we should have been having as a church for a very long time,” he said. He said the church is reviewing its policies and procedures to “provide both health and accountability for leaders.”AdvertisementContinue reading the main storyHillsong exercises some control over the financial operations of each member church, though congregations set their own budgets. Churches also pass on 5 percent of the contributions they receive to the global church. In return, they receive organizational and teaching resources, and what was at one time a straightforwardly valuable association with one of the most recognizable evangelical churches in the world.For some leaders of local Hillsong branches, the baggage has become too burdensome to be worth the benefits of affiliation.Last week, the lead pastor of Hillsong Atlanta, Sam Collier, emailed his church to inform them that he was withdrawing his church from Hillsong in the wake of “consistent media attacks, slander, and accusations” against Hillsong — some of which, he acknowledged, were true.“All the challenges and the speculation and the scandal and the articles and all of the above, it got to a point where the people in our church just did not want to deal with it anymore,” Mr. Collier said in an interview. His hiring as Hillsong’s first Black lead pastor was announced about a week before the news of Mr. Lentz’s misconduct became public in 2020, meaning his entire tenure at the church has been clouded by scandal emanating from Hillsong entities far from Atlanta.Sunday’s service was the last for Hillsong Atlanta. “We believe the Lord is calling us to move into the next season,” Mr. Collier told his congregation. Mr. Collier is launching a new church on Easter Sunday, and expects much of his Hillsong congregation to migrate there. The press office for Hillsong said there were no plans to reestablish Hillsong Atlanta.Another branch, Hillsong Kansas City, which launched in 2019, quietly separated from Hillsong about two weeks ago and relaunched as Kingdom City Church. The press office for the global church said the two parties “made a mutual decision to separate” before Mr. Houston’s departure. A person who answered the phone at Kingdom City last week said the church had no comment.AdvertisementContinue reading the main storyHillsong’s website says 150,000 people attend services weekly in 30 countries, but that estimate was taken before the pandemic. The press office said an accurate attendance count is not possible because of pandemic restrictions in some countries, and emphasized the church’s longtime focus, heightened during the pandemic, on online participation.ImageWorshippers at the last Hillsong service in Atlanta Sunday. Hillsong drew crowds with its upbeat approach to worship and soaring musical performances.Credit...Alyssa Pointer for The New York TimesMr. Houston and his wife, Bobbie, are towering figures in Australia. The church grew for decades as part of the Australian branch of the Assemblies of God, a Pentecostal denomination. The church offered original music with high production values — sometimes performed in actual concert venues. Mr. Houston once instructed pastors in Australia that a Hillsong sermon “leaves people feeling better about themselves than they came.” Pentecostalism, a charismatic movement, often features practices like speaking in tongues and faith healing. Hillsong took a more accessible approach. Always attuned to mass appeal, the church accentuated personal encounters with God, often through music. Hillsong became its own denomination in 2018.In 2020, the church’s relationship with money, sex, and celebrity came under renewed scrutiny when Mr. Houston fired Mr. Lentz for “leadership issues and breaches of trust, plus a recent revelation of moral failures.” Mr. Lentz, a one-time mentor of Mr. Bieber and a celebrity in his own right, confessed that he had been unfaithful to his wife and withdrew from public life.For Mr. Crist, leaving Hillsong was the culmination of several years of doubts about the institution. He objected a few years ago, he said, when a global church restructuring disbanded his board of local leaders and put him directly under the authority of the Australia-based global board.  And he bristled when he and other lead pastors were asked to sign noncompete and non-disparagement agreements in the wake of the scandal in the East Coast branches. He never signed.The church press office described the agreements as standard elements of their general contracts with church leaders.“This decision wasn’t arrived at lightly, and it was made calculating the significant cost,” Mr. Crist said in an interview, mentioning the possibility for disillusionment and pain. But “anyone who has been victimized in our church needs to be seen and heard.”Mr. Crist expects to begin holding services June 1 under a new name to be determined.In his sermon on Sunday, Mr. Crist called for an internal investigation into Hillsong’s global board, to make the findings of that investigation public, and to purge any board members “who have protected the institution and not the people.”"
"1648571379-1211","https://www.nytimes.com/section/us","Why It’s So Difficult to Assess Pandemic Risks Right Now","https://www.nytimes.com/2022/03/28/us/covid-california.html","Why It’s So Difficult to Assess Pandemic Risks Right Now","March 28, 2022","Soumya Karlamangla","ImageThe Santa Monica Pier on Friday.Credit...Daniel Slim/Agence France-Presse — Getty ImagesCalifornia in recent weeks has inched away from its strictest pandemic policies, lifting its indoor mask mandates and some vaccination requirements. The state last month released a long-term plan for living with the coronavirus, instead of treating it as an emergency.But at the same time, thousands of Californians continue to contract Covid-19 daily, while concerns grow that a new wave could be coming to the United States.If it seems particularly difficult to assess Covid dangers right now, that’s because it is.California has entered a new phase of the pandemic, in which its residents have more responsibility for deciding on safety precautions than ever before. And unfortunately, humans are not very good at understanding risk.Our perceptions are influenced by news coverage, policies, our personal experiences, the behaviors of people around us and so much more. Sometimes, or perhaps even often, our judgment is wildly off.AdvertisementContinue reading the main storyTake this Stanford study. In May 2020, the average American believed the risk of catching the coronavirus while grocery shopping was 40 percent, and 62 percent when on public transportation, the researchers found.At that time, the fraction of Americans who had ever tested positive for the coronavirus was less than 1 percent.“We found that people drastically overestimated the risk,” said Maria Polyakova, one of the study’s authors and an assistant professor of health policy at Stanford. “People are really not good at understanding small risks.”Add to that the fact that the risk of severe Covid varies from person to person, and that the prevalence of the virus differs across communities and changes constantly, and the calculation becomes extremely complicated. There’s no universal answer.Anne Rimoin, an epidemiologist at U.C.L.A., said she worried that there was another, new factor at play too: pandemic fatigue. She has been tracking a highly transmissible coronavirus subvariant that’s fueling a surge in Europe and becoming increasingly common here.AdvertisementContinue reading the main story“Everybody is ready for Covid to be over,” Rimoin told me. “It’s like a kid in the back seat of a car saying, ‘Are we there yet? Are we there yet?’ We’re not there yet.”But it can be difficult to translate those small risks into behavioral changes, experts say.The decisions we make — Will I fly to that wedding? Should I eat at an indoor restaurant? — tend to be yes-or-no choices, not behaviors we can modify by, say, 10 percent, said Craig McKenzie, a psychology professor at U.C. San Diego.So we’re all searching for a threshold at which we can stop adjusting our behaviors to avoid Covid, he said. And some people may already feel they have reached that place.“Flu is a risk, flying is a risk, driving is a risk — we can’t attend to all of them,” he told me. “At some point I have to act as if this doesn’t matter because, if the risk is one in a million, should I change my behavior?”For more:A C.D.C. map shows Covid risk levels in each county in California. According to the agency’s guidance, masks are not currently recommended anywhere in the state.Covid hospitalizations are rising in Los Angeles County, City News Service reports.The Biden administration plans to offer second booster shots to those 50 and up.AdvertisementContinue reading the main storyIf you read one story, make it thisWith eyes on Russia, the U.S. military prepares for an Arctic future.ImageA second-grade student received an at-home Covid-19 test in Sacramento last month.Credit...Rich Pedroncelli/Associated PressThe rest of the newsFree Covid tests: California is giving more than 14.3 million at-home Covid-19 tests to students and school employees to prevent outbreaks as they return to class from spring break, The Associated Press reports.Unemployment rate falls: California added a “staggering” 138,100 new jobs in February, The Associated Press reports.Transgender judge: The second openly transgender person to serve as a California judge was appointed on Friday by Gov. Gavin Newsom, The Associated Press reports.Grocery strike: About 47,000 central and southern California grocery workers seeking higher wages voted to strike against several major supermarket chains, The Associated Press reports.Education reformer dies: Marion Joseph, an advocate for phonics-based reading in California, died on Thursday, The Associated Press reports.Retail thefts: Nine members of a statewide organized retail theft group have been charged with conspiracy, felony grand theft and receiving stolen property, The Associated Press reports.Oscars: See the complete list of winners.SOUTHERN CALIFORNIACheap gas prices: Some Californians are crossing the border into Tijuana for cheaper gas, The Los Angeles Times reports.School misconduct: Two former Mission Viejo High School students are suing the school for failing to act on their reports of abuse decades ago, The Los Angeles Times reports.CENTRAL CALIFORNIANew ward boundaries: Bakersfield’s Punjabi residents are celebrating a City Council vote to rectify a political map that has long divided the community, The Bakersfield Californian reports.Drought: National Geographic reports on the deceptively simple plan to replenish California’s groundwater.NORTHERN CALIFORNIAPrison death: An inmate at California State Prison in Sacramento died in an attack on Saturday. The incident is being investigated as a homicide, The Associated Press reports.ImageCredit...Armando Rafael for The New York TimesWhat we’re eatingRitzy Cheddar chicken breasts.ImageJohn F. Kennedy Drive in Golden Gate Park near the De Young Museum.Credit...Cayce Clifford for The New York TimesWhere we’re travelingToday’s tip comes from Richard Forster, who recommends San Francisco’s Golden Gate Park:“The Queen Wilhelmina Garden and restored 1902 windmill, gift to the city from the Netherlands, at the western end of the park by the Pacific provides a stunning quilt of color during spring tulip season. Nearby the Beach and Park Chalet restaurants and brewpub offer a respite to enjoy the sun slipping into the ocean horizon. Bonus: the lower level is a mini-museum surrounded by WPA-era murals and a three-dimensional Golden Gate Park model located on the first floor of the building.”Tell us about your favorite places to visit in California. Email your suggestions to CAtoday@nytimes.com. We’ll be sharing more in upcoming editions of the newsletter.AdvertisementContinue reading the main storyWhat we’re recommending“CODA,” which won Best Picture at the 2022 Oscars, is being developed into a stage musical in Los Angeles.Tell usWe’ve recently been publishing your notes about why you love your corner of California.If you’d like to submit a love letter to your California city, neighborhood or region — or to the Golden State as a whole — please email us at CAtoday@nytimes.com. We’ll keep sharing your missives in the newsletter.ImageChimney Creek campground in the Southern Sierra Nevada mountains.Credit...Duncan Selby/AlamyAnd before you go, some good newsYou know about state parks, national parks and probably national forest lands. But have you visited the parts of California overseen by the Bureau of Land Management?AdvertisementContinue reading the main storyFifteen percent of California is managed by the agency, which is within the United States Department of the Interior. This includes some of the most beautiful landscapes in the state, SFGate reports.Thanks for reading. I’ll be back tomorrow. — SoumyaP.S. Here’s today’s Mini Crossword, and a clue: Tube-shaped pasta (5 letters).Mariel Wamsley and Jonah Candelario contributed to California Today. You can reach the team at CAtoday@nytimes.com.Sign up here to get this newsletter in your inbox."
