web-scraper-order,web-scraper-start-url,world,world-href,headline,date,author,article
"1649342984-19","https://www.nzherald.co.nz/topic/premium/world/","'This is a Jesus movement': The growing religious fervour in the American right","https://www.nzherald.co.nz/world/this-is-a-jesus-movement-the-growing-religious-fervour-in-the-american-right/ZDHNN7Y66CIYHDJIR2AXJ367RI/","'This is a Jesus movement': The growing religious fervour in the American right","null","By   Elizabeth Dias and Ruth Graham","They opened with an invocation, summoning God's ""hedge of thorns and fire"" to protect each person in the dark Phoenix parking lot.
         They called for testimonies, passing the microphone to anyone with ""inspirational words that
         they'd like to say on behalf of our J-6 political prisoners"", referring to people arrested in connection with the January 6, 2021, attack on the Capitol, whom they were honouring a year later.
        Then, holding candles dripping wax, the few dozen who were gathered lifted their voices, a cappella, in a song treasured by millions of believers who sing it on Sundays and know its words by heart:""Way maker, miracle worker, promise keeper""Light in the darkness, my God""That is who you are …""This was not a church service. It was worship for a new kind of congregation: a right-wing political movement powered by divine purpose, whose adherents find spiritual sustenance in political action.Keep up to date with the day's biggest storiesSign up to our daily curated newsletter for the day's top stories straight to your inbox.Please email me competitions, offers and other updates. You can stop these at any time.Email addressSign UpBy signing up for this newsletter, you agree to NZME’s Terms of Use and Privacy Policy.The Christian right has been intertwined with American conservatism for decades, culminating in the Donald Trump era. And elements of Christian culture have long been present at political rallies. But worship, a sacred act showing devotion to God expressed through movement, song or prayer, was largely reserved for church. Now many believers are importing their worship of God, with all its intensity, emotion and ambitions, to their political life.AdvertisementAdvertise with NZME.Read MoreCovid 19 coronavirus: Police warn Mt Roskill Evangelical ...Evangelical college president Jerry Falwell Jr leaves ...Hillsong founder Brian Houston drops bombshell announcement ...Destiny Church founder Brian Tamaki calls on flock ...At events across the United States, it is not unusual for participants to describe encountering the divine and feel they are doing their part to install God's kingdom on earth. For them, right-wing political activity itself is becoming a holy act.The Christian right has been intertwined with American conservatism for decades, culminating in the Donald Trump era. Photo / APThese Christians are joining secular members of the right wing, including media-savvy opportunists and those touting disinformation. They represent a wide array of discontent, from opposing vaccine mandates to promoting election conspiracy theories. For many, pandemic restrictions that temporarily closed houses of worship accelerated their distrust of government and made churchgoing political.Related articlesWorldHillsong, once a leader of Christian cool, loses footing30 Mar, 2022 07:00 PMQuick ReadLifestyleDavid Farrier: Kiwis sucked in by US conspiracy theories and alt-right5 Mar, 2022 05:00 AMQuick ReadWorldMany faith leaders wary of religious exemptions for vaccine14 Feb, 2022 11:39 AMQuick ReadNew ZealandJarrod Gilbert: The moment police should have intervened in Wellington21 Feb, 2022 05:00 AMQuick ReadAt a Trump rally in Michigan last weekend, a local evangelist offered a prayer that stated, ""Father in heaven, we firmly believe that Donald Trump is the current and true president of the United States."" He prayed ""in Jesus' name"" that precinct delegates at the upcoming Michigan Republican Party convention would support Trump-endorsed candidates, whose names he listed to the crowd.""In Jesus' name,"" the crowd cheered back.The infusion of explicitly religious fervour — much of it rooted in the charismatic tradition, which emphasises the power of the Holy Spirit — into the right-wing movement is changing the atmosphere of events and rallies, many of which feature Christian symbols and rituals, especially praise music.With spiritual mission driving political ideals, the stakes of any conflict, whether over masks or school curricula, can feel that much larger, and compromise can be even more difficult to achieve. Political ambitions come to be about defending God, pointing to a desire to build a nation that actively promotes a particular set of Christian beliefs.""What is refreshing for me is, this isn't at all related to church, but we are talking about God,"" said Patty Castillo Porter, who attended the Phoenix event. She is an accountant and officer with a local Republican committee to represent ""the voice of the Grassroots/America First posse"" and said she loved meeting so many Christians at the rallies she attends to protest election results, border policy or Covid mandates.""Now God is relevant,"" she said. ""You name it, God is there, because people know you can't trust your politicians, you can't trust your sheriffs, you can't trust law enforcement. The only one you can trust is God right now.""AdvertisementAdvertise with NZME.The parking lot vigil was sponsored by a right-wing voter mobilisation effort focused on dismantling election policy. Not everyone there knew the words to Way Maker, the contemporary Christian megahit. A few men, armed with guns and accompanied by a German shepherd, stood at the edge of the gathering, smoking and talking about what they were seeing on Infowars, a website that traffics in conspiracy theories. Others, many of whom attended charismatic or evangelical churches, sang along.Worship elements embedded into these events are recognisably evangelical. There is prayer and proclamation, shared rituals and stories. Perhaps the most powerful element is music. The anthems of the contemporary evangelical church, many of which were written in just the last few years, are blending with rising political anger, becoming the soundtrack to a new fight.A growing belief among conservative Christians is that the United States is on the cusp of a revival, one where spiritual and political change are bound together. Photo / APReligious music, prayer and symbols have been part of protest settings throughout American history, for diverging causes, including the Civil Rights movement. Music is personal, able to move listeners in ways sermons or speeches cannot. Singing unites people in body and mind and creates a sense of being part of a story, a song, greater than yourself.The sheer dominance of worship music within 21st-century evangelical culture means that the genre has been used outside church settings by the contemporary left as well. Way Maker, for example, was sung at some demonstrations for racial justice in the summer of 2020.The use of music is now key to movement-building power on the right.At the protest that paralysed the Canadian capital in February, a group of demonstrators belted out, ""I raise a hallelujah, my weapon is a melody"" from a hit from the influential California label Bethel Music. Amid the honks of trucks, they called on God to metaphorically topple the walls of Parliament, recalling the biblical story of how God crumbled the walls of Jericho, and to end vaccine mandates.At a recent conference in Arizona promoting anti-vaccine messages and election conspiracy theories, organisers blasted Fresh Wind, from the global church Hillsong, and a rock-rap novelty song with a chorus that began, ""We will not comply.""A growing belief among conservative Christians is that the United States is on the cusp of a revival, one where spiritual and political change are bound together.""We are seeing a spiritual awakening taking place,"" said Ché Ahn, the pastor of Harvest Rock Church in Pasadena, who became a hero to many when his church successfully sued Governor Gavin Newsom of California for banning indoor worship during the pandemic. ""Christians are becoming more involved, becoming activists. I think that is a good thing, because the church has been slumbering.""The explicit use of evangelical worship for partisan protest took root in the early pandemic lockdowns — notably, after California banned indoor church services and singing. Sean Feucht, a worship leader from Northern California, ran a failed campaign for Congress in 2020 and then launched a series of outdoor events, titled ""Let Us Worship"", to defy pandemic restrictions. Thousands of Christians flocked to his events, where prayer and singing took on a new valence of defiance.When Feucht staged a worship event on the National Mall last September 11, Trump contributed a video in which he praised Feucht for ""uniting citizens of all denominations and backgrounds to promote faith and freedom in America"". Even before the pandemic, he and other worship leaders were courted by Trump, who identified celebrities within the charismatic movement as natural allies.Church v stateSince late last year, rallies and protests against Covid restrictions have expanded to include other conservative causes. On the San Diego waterfront in January, local activists who opposed vaccine and mask mandates held a worship protest called ""Freedom Revival"", which combined Christian music with conservative speakers and booths promoting gun ownership and ballot initiatives that opposed medical mandates.Shaun Frederickson, one of the organisers, who has resisted the San Diego municipal government's Covid response and called it ""propaganda"", said it was wrong to understand the event simply as protesting Covid-related mandates. It was about something deeper, he said in an interview: the idea that Christian morality is the necessary foundation for governance in a free republic.""Christians are the ones that are responsible for granting you and myself the right and authority over government,"" he said. ""Our motivation with the worship was to entertain people that need to be entertained, while we are going to hit them heavy with truth.""At the revival, as worship music played gently, Frederickson, in a cardigan and cuffed skinny jeans, urged the crowd to not believe ""the lie"" of the separation of church and state.Among the speakers was Heidi St. John, a home-schooling advocate running for Congress in Washington state. She praised Moses' mother — ""She did not comply!"" — and exhorted people to leave their churches if their pastors were too politically ""timid"".Ahn, the pastor of Harvest Rock Church in Pasadena, who also spoke at the event, said he did not see it simply as a worship service or a political rally. ""It is both,"" he said. ""My understanding of Jesus' kingdom is that he is Lord, not just over the church, but every aspect of society. That means family, education, arts, entertainment, business for sure, and government.""Worship is increasingly becoming a central feature of right-wing events not aimed at exclusively Christian audiences.ReAwaken America events, hosted by an Oklahoma talk-show personality and entrepreneur, are touted as gatherings of ""truth-seekers"" who oppose pandemic precautions, believe that the 2020 election was stolen, distrust Black Lives Matter and want to explore ""what really happened"" on January 6. Most of the events are hosted by large churches, and the primary sponsor is Charisma News, a media outlet serving charismatic Christians.'Take our country back'In February, a ReAwaken event at Trinity Gospel Temple in Canton, Ohio, opened with a set of worship music from Melody Noel Altavilla, a songwriter and worship leader at Influence Church in Anaheim, California. ""Your presence fills the temple when we worship you,"" Altavilla sang. The music soared in the darkened sanctuary.In an interview, Altavilla said she was excited to be asked to perform because it was a chance to ""create space for God"" at a secular event.She said she felt increasingly called to political action as part of her duty as a Christian. She recalled a biblical account in which men singing and praying went ahead of the Israelite army into battle. ""Imagine if the armies in the Old Testament said, 'No, Lord, this is too political; the worshippers can't go out in front of the soldiers,'"" she said.Compared with 2016, Trump rallies are taking on the feel of worship events, from the stage to the audience. When Trump held his first rally of the year in Florence, Arizona, in January, he descended via helicopter into a jubilant crowd.""I lay the key of David upon you,"" Anthony Kern, a candidate for the Arizona state Senate who was photographed on the Capitol steps on January 6, 2021, proclaimed to the crowd from the stage, paraphrasing a biblical passage about power given by God. ""That means the governmental authority is upon you, men and women.""Standing in the crowd, Kathy Stainbrook closed her eyes and raised her arms high in worship. She had come from Shasta County, California, with a group of Christian women involved in the Shasta County Freedom Coalition, a collection of right-wing groups that has included a militia, according to its website, and has supported an effort to recall a Republican county supervisor. The coalition also promotes ""biblical citizenship"" classes.A friend of Stainbrook's, Tami Jackson, who was also in the crowd, said she had come to see politics as an inherently spiritual struggle.She said she wanted to be a part of ""staking claim"" to what God was doing. ""This is a Jesus movement,"" Jackson said. ""I believe God removed Donald for a time so the church would wake up and have confidence in itself again to take our country back.""This article originally appeared in The New York Times.
Written by: Elizabeth Dias and Ruth Graham
Photos: Jenna Schoenefeld, AP
© 2022 THE NEW YORK TIMES
To continue reading this article and to support great journalismFor the first 16 weeks* pay just$ 5$1.99per weekSee offersFull access to the very best Herald content including business insights, in-depth analysis and investigative journalismExpand your world view with content from leading global publishersYour subscription includes subscriber-only features such as curated newsletters, Q and A sessions and article commentingAlready have an account?Sign inEligible newspaper subscribers, find outhow to activate your digital subscription"
