web-scraper-order,web-scraper-start-url,ap_news,ap_news-href,headline,date,author,article,image-src
"1648576598-1413","https://apnews.com/hub/ap-top-news","WASHINGTON (AP) — Justice Clarence Thomas participated in arguments at the Supreme Court via telephone rather than in person on Monday following a hospital stay of nearly a week.","https://apnews.com/article/supreme-court-justice-clarence-thomas-attends-remotely-e1ea59190bc02c0ab8e07427e4b1d69a","Justice Thomas joins arguments remotely after hospital stay","yesterday","null","WASHINGTON (AP) — Justice Clarence Thomas participated in arguments at the Supreme Court via telephone rather than in person on Monday following a hospital stay of nearly a week.Chief Justice John Roberts said at the beginning of arguments that the 73-year-old Thomas would be “participating remotely this morning,” but did not say why. Thomas’ voice was clear when he asked several questions during arguments over a federal law meant to protect railroad workers, at one point making an analogy to when he drives his 40-foot long motor coach.“Some of this seems a little bit counterintuitive and I admit to being a little bit wrapped around the axle,” Thomas said, eliciting smiles from some colleagues. Thomas also posed questions in the day’s second case about arbitration.ADVERTISEMENTOther justices have participated in arguments remotely since the court started its term in the fall.Thomas missed all three days of arguments last week while he was hospitalized, although he is planning to take part in the decisions, Roberts said.Coronavirus pandemicPoland holds composer Penderecki's state funeral after delayEverton announces $130M+ losses for 3rd straight yearAmericans ease up on masks, virus safeguards: AP-NORC pollMan in Gov. Whitmer plot trial talked about hanging leaders Thomas was admitted to the hospital March 18 after experiencing “flu-like symptoms” and was treated for an infection with intravenous antibiotics. Thomas did not have COVID-19, the court said. He has been vaccinated and had a booster shot, like the rest of the court. Though the court had said Thomas was expected to be released from the hospital by Tuesday, he was not discharged until Friday. The court did not say why he remained in the hospital longer than initially thought or what kind of infection he was treated for.Thomas, a conservative and appointee of former President George H.W. Bush, has been on the court since 1991.Earlier this term, Justice Brett Kavanaugh participated remotely from his home after testing positive for COVID-19 and Justice Sonia Sotomayor participated remotely from her office when coronavirus case counts were particularly high. Justice Neil Gorsuch also participated remotely after getting what the court described as a “stomach bug,” but testing negative for COVID-19. Because of the pandemic the court spent more than a year and a half hearing arguments remotely, with every justice participating by phone. While the justices and lawyers arguing the cases are back in the courtroom, it is still closed to the public.But the court has relaxed some coronavirus-related requirements, making the wearing of masks optional for reporters and lawyers who have tested negative for COVID-19.There was a second empty seat Monday, too. Justice Amy Coney Barrett didn’t take part in either case because she was involved at earlier stages as a federal appeals court judge.","null"
"1648576608-1418","https://apnews.com/hub/ap-top-news","WASHINGTON (AP) — Federal health regulators issued a negative review Monday of a closely watched experimental drug for the debilitating illness known as Lou Gehrig's disease, after months of lobbying by patient advocates urging approval.","https://apnews.com/article/science-business-health-lou-gehrigs-disease-6ba188f586bdd0726aec031cdaaa7643","FDA skeptical of benefits from experimental ALS drug","yesterday","By MATTHEW PERRONE","WASHINGTON (AP) — Federal health regulators issued a negative review Monday of a closely watched experimental drug for the debilitating illness known as Lou Gehrig’s disease, after months of lobbying by patient advocates urging approval.The drug from Amylyx Pharmaceuticals has become a rallying cause for patients with the deadly neurodegenerative disease ALS, their families and members of Congress who’ve joined in pushing the Food and Drug Administration to greenlight the drug.But regulators said in a review that the company’s small study was “not persuasive,” due to missing data, errors in enrolling patients and other problems. On Wednesday, a panel of FDA advisers will take a non-binding vote on whether the drug should be approved.The meeting is being closely watched as an indicator of the FDA’s approach to experimental drugs with imperfect data and its ability to withstand outside pressure. ADVERTISEMENTThe FDA’s negative stance on the drug sets up a tense scenario at Wednesday’s public session, where several dozen ALS patients and advocates are scheduled to speak. The agency will consider the input from its advisory panel before making a final decision on the drug, expected by June.ScienceUS seeks new lithium sources as demand for batteries growsWithout Russia, science going solo on world's woes, dreams  Scientists figure out how vampire bats got a taste for bloodAtom-smashing CERN lab ratchets up measures against RussiaALS, or amyotrophic lateral sclerosis, destroys nerve cells needed to walk, talk, swallow and — eventually — breathe. There is no cure and most people die within three to five years.Amylyx’s drug is a combination of two older drugs: a prescription medication for liver disorders and a dietary supplement associated with traditional Chinese medicine. Amylyx has patented the combination in a powder and says the chemicals help protect cells from early death. But the reviewers found the drug had “only a modest” effect on slowing the disease’s progression in a 137-patient, mid-stage study, which reviewers said was plagued with implementation and analysis problems. Typically, FDA approval requires two large studies or one study with a “very persuasive” effect on survival.According to the FDA document, regulators had “strongly suggested” Amylyx complete a large, late-stage trial to establish the drug’s effectiveness before applying. That study is due to be finished in 2024.After further discussions with regulators last summer, Amylyx decided to submit its drug for approval based on the initial study plus survival data gathered afterwards. The company said that data showed patients who took the drug lived about six months longer than those taking a dummy drug.But FDA says the results are unreliable because of problems tracking the study participants for several years.ADVERTISEMENTWednesday’s meeting marks the first time FDA has convened this advisory panel since disregarding its advice last June and approving Biogen’s  Alzheimer’s drug, Aduhelm. Three panel members resigned over the controversial decision and congressional investigators launched a probe into FDA’s handling of the drug’s review. As in the current case, the FDA faced intense pressure from patient groups to grant approval.Currently, there are only two FDA-approved drugs for ALS, the more effective of which extends life by several months.The ALS Association, which helped fund Amylyx’s research, said the FDA’s review does not take into account “the speed and severity of ALS and the few treatment options available.”“This is a uniformly fatal disease so any drug that shows this benefit— and even if that benefit is modest— is fantastic for patients, who have one path forward with this disease: death,” said Johns Hopkins University’s Dr. Jeffrey Rothstein, who helped enroll patients in the Amylyx study.Shares of the Cambridge, Massachusetts-based drugmaker fell more than 35% in trading Monday after the FDA posted its review.___This story has been corrected to note that the drug is a powder, not a pill.___The Associated Press Health and Science Department receives support from the Howard Hughes Medical Institute’s Department of Science Education. The AP is solely responsible for all content.","null"
"1648576656-1441","https://apnews.com/hub/ap-top-news","WASHINGTON (AP) — Job openings hovered at a near-record level in February, little changed from the previous month, continuing a trend that Federal Reserve officials see as a driver of inflation. There were 11.3 million available jobs last month, matching January's figure and just below December's record of 11.4 million, the  Labor Department said Tuesday.","https://apnews.com/article/business-inflation-a7be3647a1df95104eb3f65a22bfe4ca","US job openings, quitting at near record high in February","today","By CHRISTOPHER RUGABER","WASHINGTON (AP) — Job openings hovered at a near-record level in February, little changed from the previous month, continuing a trend that Federal Reserve officials see as a driver of inflation. There were 11.3 million available jobs last month, matching January’s figure and just below December’s record of 11.4 million, the  Labor Department said Tuesday. The number of Americans quitting their jobs was also historically high, at 4.4 million, up from 4.3 million in January. More than 4.5 million people quit in November, the most on records dating back two decades. Many people are taking advantage of numerous opportunities to switch jobs, often for higher pay. The vast majority of those quitting do so to take another position. Tuesday’s report is separate from the government’s monthly employment report, which in February showed that employers added a robust 678,000 jobs.ADVERTISEMENTThe data “shows that the labor market remains torrid,” Stephen Stanley, chief economist at Amherst Pierpont, said in a research note. “In a month when the economy added 678,000 jobs, the number of job openings only went down by 17,000. That speaks to the depth of the bid that employers have for labor.” BusinessUkraine's other fight: Growing food for itself and the worldEXPLAINER: What would paying for natural gas in rubles mean?Biden budget has Manchin priorities: Tax rich, cut deficitUnitedHealth to buy LHC Group for $5.4 billionThe outsize number of available jobs and quits has contributed to rampaging inflation, as many companies have had to raise pay to attract and keep workers. In February, there were 1.8 openings for every unemployed worker. Before the pandemic, there were usually more unemployed people than job openings. The unemployment rate, at 3.8%, is near the pre-pandemic level of 3.5%, which was the lowest in five decades. And there are still several million fewer people working or looking for work than before the pandemic, forcing employers to compete among a smaller labor pool. Because of those trends, Federal Reserve Chair Jerome Powell has singled out openings and quits as a key measure of the labor market’s health and a target of the Fed’s interest-rate policies. Powell has said that the central bank hopes to reduce the number of available jobs as a way of cooling wage increases and price inflation. “If you were just moving down the number of job openings ... you would have less upward pressure on wages,” Powell said. “We need to use our tools to move supply and demand back” into alignment. With employers desperate to find workers, wages and salaries rose 4.5% in 2021, the fastest pace in at least two decades. Many businesses have, in turn, charged their customers more to cover the higher labor costs.Inflation jumped 7.9% in February from a year earlier, a four-decade high. ADVERTISEMENTEarlier this month the Fed said it had raised its short-term interest rate for the first time in four years, to about 0.375%, to rein in inflation. More rate hikes are expected this year, including potentially one or more half-point increases. Powell’s hope is that by reducing job openings and slowing wage gains, the Fed can bring down inflation without causing widespread layoffs and pushing unemployment higher. Economists overall are skeptical, however, that the Fed can achieve such a “soft landing” for the economy. They worry that the Fed’s rate hikes will result in job losses and potentially even a recession.","null"
"1648576647-1437","https://apnews.com/hub/ap-top-news","HONG KONG (AP) — Hong Kong’s deadliest coronavirus outbreak has cost about 6,000 lives this year – and the city is now running out of coffins.Authorities have scrambled to order more, with the government saying 1,200 coffins had reached the city last week with more to come.","https://apnews.com/article/covid-business-health-lifestyle-asia-57ff5557dc356978806da1e9ce995a7d","Hong Kong’s COVID toll leads some to eco-friendlier coffins","today","By ALICE FUNG and JANICE LO","HONG KONG (AP) — Hong Kong’s deadliest coronavirus outbreak has cost about 6,000 lives this year – and the city is now running out of coffins.Authorities have scrambled to order more, with the government saying 1,200 coffins had reached the city last week with more to come.Space constraints make cremation a common burial practice in the densely populated island territory off the Chinese mainland, and the coffins typically are wood or wood substitutes.To answer the shortage of them due to the COVID-19 toll, some companies are offering alternatives such as an environmentally friendly cardboard coffin.LifeArt Asia has cardboard coffins made of recycled wood fiber that can be customized with designs on the exterior. In its factory in Aberdeen, a southern district of Hong Kong, up to 50 coffins can be produced a day.CEO Wilson Tong said there is still some resistance to using caskets made of cardboard. “(People feel that) it’s a little bit shameful to use so-called paper caskets. They feel that this is not very respectful to their loved ones,” Tong said. ADVERTISEMENTBut he noted the company has designs that can reflect religion or hobbies and the coffin can even have a personalized color. “So it gives more than enough sufficient choices to the people, and so that they can customize the funeral and offer a more pleasant farewell without the fear of death.”Coronavirus pandemicPoland holds composer Penderecki's state funeral after delayEverton announces $130M+ losses for 3rd straight yearAmericans ease up on masks, virus safeguards: AP-NORC pollMan in Gov. Whitmer plot trial talked about hanging leaders The company says its cardboard coffins, when burned during the cremation, emits 87% less greenhouse gas compared to those made of wood or wood substitutes. Each LifeArt coffin weights about 10.5 kilograms (23 pounds), and can carry a body that weights up to 200 kilograms (441 pounds).Hong Kong has reported about 200 deaths daily on average over the past week as many elderly residents who were unvaccinated die from COVID-19. The surge has put a strain on mortuaries, and refrigerated containers are being used to temporarily store bodies.Amid the rising toll, nonprofit Forget Thee Not, which advises people on their choices for last rites, bought 300 cardboard coffins and caskets to either send to hospitals or give to families who need them.“We have been promoting environmental-friendly and personalized funerals. Now we see that Hong Kong needs more coffins. There are not enough coffins for the bodies in our hospitals,” said Albert Ko, a board director at Forget Thee Not. Ko said some of the elderly who discussed their last rites with the organization have been open-minded and welcoming to the idea of eco-coffins.“We hope to take this opportunity to contribute as well as promote eco-coffins,” he said.___This story corrects the name of Forget Thee Not on second reference.","null"
"1648576623-1425","https://apnews.com/hub/ap-top-news","WASHINGTON (AP) — A “Billionaire Minimum Income Tax” is included in President Joe Biden’s fiscal year 2023 budget proposal — part of the administration’s effort to reduce the federal deficit over the next decade and fund new spending.","https://apnews.com/article/billionaire-income-tax-biden-budget-bed3de13ae69f37469a51b871758cf18","EXPLAINER: How would billionaire income tax work?","today","By FATIMA HUSSEIN","WASHINGTON (AP) — A “Billionaire Minimum Income Tax” is included in President Joe Biden’s fiscal year 2023 budget proposal — part of the administration’s effort to reduce the federal deficit over the next decade and fund new spending. The proposal “eliminates the inefficient sheltering of income for decades or generations,” the White House says. During a press conference highlighting the budget on Monday, Biden said one-hundredth of 1% of Americans would be subject to the tax. “The billionaire minimum tax is fair, and it raises $360 billion that can be used to lower costs for families and cut the deficit,” he said. Whether Congress will approve is a major question as the administration outlines its hope to tax the nation’s highest earners. Here’s how it would work:ADVERTISEMENTHOW WOULD THE TAX APPLY?The budget proposes that households worth more than $100 million pay at least 20% in taxes on both income and “unrealized gains”— the increase in an unsold investment’s value. For many wealthy individuals, the administration says, that “true income” never gets taxed since it can be held onto for decades and sometimes generations.BusinessUkraine's other fight: Growing food for itself and the worldEXPLAINER: What would paying for natural gas in rubles mean?Biden budget has Manchin priorities: Tax rich, cut deficitUnitedHealth to buy LHC Group for $5.4 billionBiden’s proposal would allow wealthy households to spread some payments on unrealized gains over nine years, and then for five years on new income going forward. Stretching payments over multiple years is meant to smooth yearly variations in investment income, while still ensuring that the wealthiest end up paying a minimum tax rate of 20%. In effect, the Billionaire Minimum Income Tax payments are a prepayment of tax obligations these households will owe when they later realize their gains.This is an extremely nuanced policy. The tax is targeting the ultra wealthy. It’s taxing gains achieved from their wealth, but it’s real and unrealized income rather than simply the underlying assets.That’s why David Gamage, a tax law professor at Indiana University says “it’s not a wealth tax, it’s an income tax reform.” He says, “This is a minimum income tax that includes the true economic value” of income that can be held for a very long time, he said. WHO WOULD SEE THE IMPACT?Roughly 700 billionaires would be affected by the tax proposal, the White House says, estimating that these individuals increased their wealth in 2021 by $1 trillion, paying roughly 8% of their income and unrealized gains in taxes.“A firefighter and a teacher pay more than double” the tax rate that a billionaire pays, Biden said during Monday’s press conference.Elon Musk, Bill Gates, Jeff Bezos, Warren Buffet and Michael Bloomberg are just a well-known few individuals who could see the earnings on their holdings taxed under this proposal if it were to become law.HOW MUCH MONEY WOULD IT RAISE?ADVERTISEMENTAccording to the White House, $361 billion over 10 years. The budget proposal contains an additional $1.4 trillion worth of revenue raisers, which would include a higher top tax rate of 39.6% on individuals and an increase in the corporate tax rate to 28%.HOW DO VOTERS FEEL?The subject of tax avoidance has grown in recent years. A ProPublica report from last June outlined how the wealthiest Americans can legally pay income taxes that are a fraction of what middle income Americans pay on their income. And a Pew Research Center study from last April states that most Americans — some 59%— say they are bothered “a lot” that some corporations and wealthy people don’t pay their fair share in taxes.A 2017 Gallup poll states that slightly more than six in 10 Americans say that upper-income people pay too little in taxes. IS CONGRESS LIKELY TO APPROVE THIS MEASURE?Donald Williamson, an accounting and taxation professor at American University in Washington, said “a couple of years ago, I would’ve laughed out loud. Today it’s conceivable.”The highest likelihood is through “reconciliation” — a budget process for passing fiscal legislation with a simple majority of Senate votes. That will require buy-in from West Virginia Sen. Joe Machin and Arizona Sen. Kyrsten Sinema, who have each objected to proposals to tax the ultra-wealthy in the past. Steve Wamhoff, director of tax policy at the Institute on Taxation and Economic Policy, says the Democrats “have got this reconciliation vehicle that they can use that to pass legislation.” “This is a step toward a much fairer tax code.”___Associated Press writer Josh Boak contributed to this report.","null"
