web-scraper-order,web-scraper-start-url,ap_news,ap_news-href,headline,date,author,article,image-src
"1648576625-1426","https://apnews.com/hub/ap-top-news","LVIV, Ukraine (AP) — Ukrainian forces claimed to have retaken a Kyiv suburb and an eastern town from the Russians in what is becoming a back-and-forth stalemate on the ground, while negotiators began assembling for another round of talks Tuesday aimed at stopping the fighting.","https://apnews.com/article/russia-ukraine-zelenskyy-europe-middle-east-moscow-228818da3fac47533414ea9bd40a4029","Ukrainians claim to retake ground ahead of latest talks","today","By YURAS KARMANAU","LVIV, Ukraine (AP) — Ukrainian forces claimed to have retaken a Kyiv suburb and an eastern town from the Russians in what is becoming a back-and-forth stalemate on the ground, while negotiators began assembling for another round of talks Tuesday aimed at stopping the fighting.Ahead of the talks, to be held in Istanbul, Ukrainian President Volodymyr Zelenskyy said his country is prepared to declare its neutrality, as Moscow has demanded, and is open to compromise on the fate of the Donbas, the contested region in the country’s east.The mayor of Irpin, a northwestern Kyiv suburb that has been the scene of some of the heaviest fighting near the capital, said Monday that the city has been “liberated” from Russian troops.ADVERTISEMENTZelenskyy warned that Russian forces are trying to regroup after losing the area.“We still have to fight, we have to endure,” the president said late Monday in his nighttime video address to the nation. “We can’t express our emotions now. We can’t raise expectations, simply so that we don’t burn out.”Irpin gained wide attention after photos circulated of a mother and her two children who were killed by shelling as they tried to flee, their bodies lying on the pavement with luggage and a pet carrier nearby.A senior U.S. defense official said the U.S. believes the Ukrainians have also retaken the town of Trostyanets, south of Sumy, in the east.The official, who spoke on condition of anonymity to discuss U.S. intelligence assessments, said Russian forces largely remained in defensive positions near the capital, Kyiv, and were making little forward progress elsewhere in the country.The official said Russia appeared to be de-emphasizing ground operations near Kyiv and concentrating more on the Donbas, the predominantly Russian-speaking region where Moscow-backed rebels have been waging a separatist war for the past eight years.Late last week, with its forces bogged down in parts of the country, Russia seemed to scale back its war aims, saying its main goal was gaining control of the Donbas.While that suggested a possible face-saving exit strategy for Russian President Vladimir Putin, it also raised Ukrainian fears that the Kremlin intends to split the country in two and force it to surrender a swath of its territory.Live Updates– Russia says it will scale back near Kyiv as talks progress– Live updates: West remains wary of Russia's scale back claimMeanwhile, a cyberattack knocked Ukraine’s national telecommunications provider Ukrtelecom almost completely offline. The chief of Ukraine’s state service for special communication, Yurii Shchyhol, blamed “the enemy” without specifically naming Russia and said most customers were cut off from telephone, internet and mobile service so that coverage could continue for Ukraine’s military.Also Monday, an oil depot in western Ukraine’s Rivne region was hit by a missile attack, the governor said. It was the second attack on oil facilities in the region near the Polish border.In recent days, Ukrainian troops have pushed the Russians back in other sectors.In the city of Makariv, near a strategic highway west of the capital, Associated Press reporters saw the carcass of a Russian rocket launcher, a burned Russian truck, the body of a Russian soldier and a destroyed Ukrainian tank after fighting there a few days ago. In the nearby village of Yasnohorodka, the AP witnessed positions abandoned by Ukrainian soldiers who had moved farther west, but no sign of Russian troops.And on Friday, the U.S. defense official said the Russians were no longer in full control of Kherson, the first major city to fall to Moscow’s forces. The Kremlin denied it had lost full control of the southern city.ADVERTISEMENTRussia has long demanded that Ukraine drop any hope of joining NATO, which Moscow sees as a threat. Zelenskyy, for his part, has stressed that Ukraine needs security guarantees of its own as part of any deal.Over the weekend, Zelenskyy said he is ready to agree to neutrality. He also said that “Ukraine’s sovereignty and territorial integrity are beyond doubt,” while suggesting at the same time that compromise might be possible over “the complex issue of Donbas.”The Ukrainian leader has suggested as much before but rarely commented so extensively. That could create momentum for the talks, for which the Russian delegates arrived in Istanbul on Monday, Turkish media reported.Still, it was not clear how a compromise on the Donbas would square with maintaining Ukraine’s territorial integrity.In other developments:— President Joe Biden made no apologies for calling for Putin’s ouster, saying he was expressing his “moral outrage,” not a new U.S. policy. Over the weekend, Biden said, “For God’s sake, this man cannot remain in power.” On Monday, the president said: “I’m not walking anything back.”— U.N. Secretary-General Antonio Guterres said he has launched an effort to achieve a humanitarian cease-fire that would allow aid to be brought in and people to move around safely.— Russia’s invasion has most Americans at least somewhat worried that the U.S. will be drawn directly into the conflict and could be targeted with nuclear weapons, according to a poll  from The Associated Press-NORC Center for Public Affairs Research.— T he Group of Seven major economies rejected  a Kremlin demand that some countries pay in rubles for Russia’s natural gas. That demand appeared designed to support the Russian currency, which is under pressure from Western sanctions.Earlier talks, both by video and in person, have failed to make progress on ending the more than month-old war  that has killed thousands and driven more than 10 million Ukrainians from their homes. That includes almost 4 million who have fled the country.In the besieged southern port of Mariupol, the mayor said half the pre-war population of more than 400,000 has fled, often under fire, during weeks of shooting and shelling.Alina Beskrovna, who escaped the city in a convoy of cars and made it to Poland, said desperate people are melting snow for water and cooking on open fires despite the risk of bombardment, “because if you don’t, you will have nothing to eat.”“A lot of people are just, I think, starving to death in their apartments right now with no help,” she said. “It’s a mass murder that’s happening at the hands of the Russians.”Putin’s ground forces have become bogged down because of stronger-than-expected Ukrainian resistance, combined with what Western officials say are Russian tactical missteps, poor morale, shortages of food, fuel and cold weather gear, and other problems. Moscow has resorted to pummeling Ukrainian cities with artillery and airstrikes.In Stoyanka village near Kyiv, Ukrainian soldier Serhiy Udod said Russian troops had taken up defensive positions and suffered heavy losses.The Russians probably “thought it would be like Crimea,” which the Kremlin annexed in 2014. “But here it’s not like in Crimea. We are not happy to see them. Here they suffer and get killed.”___Andrea Rosa in Kharkiv, Nebi Qena in Kyiv, Cara Anna in Lviv and Associated Press journalists around the world contributed to this report.___Follow the AP’s coverage of the war at https://apnews.com/hub/russia-ukraine","null"
"1648576631-1429","https://apnews.com/hub/ap-top-news","NEW YORK (AP) — When a Pulitzer Prize-winning architecture critic panned Donald Trump's plans for a new Manhattan skyscraper, Trump responded by suing.","https://apnews.com/article/russia-ukraine-business-manhattan-europe-campaigns-52297b4a53f368eacfdc21538adce4b3","Trump suit against Clinton part of longtime legal strategy","today","By JILL COLVIN, ERIC TUCKER and BERNARD CONDON","NEW YORK (AP) — When a Pulitzer Prize-winning architecture critic panned Donald Trump’s plans for a new Manhattan skyscraper, Trump responded by suing.  When the tenants of a building he was trying to clear sued to halt their evictions, Trump slapped back by filing suit against the law firm representing the tenants. And when an author said the former president was worth far less than he’d claimed, Trump again took legal action.So when Trump last week filed a sprawling suit accusing his 2016 rival Hillary Clinton and the Democratic Party of conspiring to sink his winning presidential campaign by alleging ties to Russia — renewing one of his longest-standing perceived affronts — it wasn’t a surprise.ADVERTISEMENTTrump has spent decades repurposing political and personal grievances into causes of legal action. Throughout his business and political career, he has used the courts as a venue to air his complaints and as a tool to intimidate adversaries, sully their reputations and try to garner media attention.Russia-Ukraine warLive updates: West remains wary of Russia's scale back claimEXPLAINER: What would paying for natural gas in rubles mean?Many in Mideast see hypocrisy in Western embrace of UkraineUkraine's other fight: Growing food for itself and the world“It’s part of his pattern of using the law to punish his enemies, as a weapon, as something it was never intended to be,” said James D. Zirin, a former federal prosecutor in Manhattan and the author of the book “Plaintiff in Chief,” which details Trump’s legal history. “For him, litigation was a way of life.”Trump’s latest lawsuit revisits a familiar grievance: that Democrats in 2016 concocted fictitious claims that his campaign was colluding with Russia and that the FBI as a result pursued an “unfounded” investigation.The 108-page suit, as much a political screed as a legal document, names as defendants longstanding targets of his ire from both the political realm — Clinton and her aides — and the law enforcement community, including former FBI Director James Comey and Peter Strzok and Lisa Page, two FBI officials who exchanged critical text messages about Trump during the 2016 campaign. It also piggybacks off the work of special counsel John Durham, listing as defendants the three people — a cybersecurity attorney, an ex-FBI lawyer and a Russia analyst — who have been charged in that criminal probe. Trump, in the suit, paints himself as the victim of a vast, racketeering conspiracy in which FBI officials who led the investigation knew that it was “based on a false and contrived premise.”“Acting in concert, the Defendants maliciously conspired to weave a false narrative that their Republican opponent, Donald J. Trump, was colluding with a hostile foreign sovereignty,” his lawyers wrote, describing the alleged scheme as “so outrageous, subversive and incendiary that even the events of Watergate pale in comparison.”ADVERTISEMENTIt’s well-established through a Justice Department inspector general investigation that the FBI made errors and missteps during the Russia probe that Trump could look to seize on if his lawsuit advances. But Russia did meddle in the 2016 election.U.S. intelligence agencies concluded in January 2017 that Russia mounted a far-ranging influence campaign aimed at helping Trump beat Clinton. And the bipartisan Senate Intelligence Committee, after three years of investigation, affirmed those conclusions, saying intelligence officials had specific information that Russia preferred Trump and that Russian President Vladimir Putin had “approved and directed aspects” of the Kremlin’s influence campaign. It also found clear ties between Trump’s campaign and Russia, concluding that Trump’s campaign chairman had had regular contact with a Russian intelligence officer and that other Trump associates were eager to exploit the Kremlin’s aid.Former special counsel Robert Mueller, who was charged with further investigating the links between Trump and Russia, did not establish a criminal conspiracy between Russia and the Trump campaign, but concluded that Russian interference was “sweeping and systematic.” His investigation resulted in criminal charges against 34 people and three entities, including 26 Russians, Trump’s former campaign chair and national security adviser.Representatives for Trump did not respond to requests for comment. But Trump attorney Alina Habba defended his approach on Newsmax, telling the network more suits were coming “soon.”“We have another suit being filed shortly,” she said. “And anybody that’s going to try and make up malicious stories about him while he was sitting as president, prior to his presidency or now is going to be sued.”Trump, meanwhile, was already using the filing to rile up his crowds at a rally in Georgia Saturday night.“To fight back against this corrupt establishment’s relentless hoaxes and lies, this week I filed a historic lawsuit to hold them accountable for the Russia, Russia, Russia hoax,” Trump said to cheers. His mention of Clinton prompted especially loud applause and a revival of the “Lock her up!” chant that was a defining feature of his 2016 campaign.In addition to serving as a useful political cudgel, Trump’s effort, which comes as he is mulling another run for the White House, could lend the imprimatur of credibility to campaign trail grievances, said Stephen Gillers, a New York University professor of legal ethics.“To the unaware public, the fact that grievances are repackaged as legal claims adds credibility to the force of those grievances,” Gillers said. “Anyone who pays attention to what goes on in the courts will be able to see through these claims as claims of political victimization in another form. But the public by and large does not pay attention to the validity of the claims.”Last year, Trump took similar action, filing suits against three of the country’s biggest tech companies, claiming he and other conservatives had been wrongfully censored after his accounts were suspended.It’s a tactic Trump has used again and again. In the real estate, casino and other industries where the former president made fortunes and lost them, Trump’s use of lawsuits as a business weapon was legendary. He sued or threatened to sue contractors, business partners, tax authorities and the media.“Trump loved to sue, especially parties that could not afford a legal defense,” said Barbara Res, a former longtime Trump Organization executive turned critic. She said one legal tactic he turned to often was the “preventive strike” suit to weaken rivals and create the impression he was the aggrieved party before they acted.“Trump’s perception and that of many people is that the first person to sue has a legitimate complaint,” Res said.Indeed, when Trump defaulted on a giant Deutsche Bank loan for his Chicago hotel and condo tower during the 2008 financial crisis, he didn’t wait to be sued. Instead, he filed a complaint accusing the lender of “predatory lending practices” that hurt his reputation and helped trigger the global depression. Instead of paying the bank, he argued, the bank should be paying him.It was a novel argument and one that ultimately succeeded. Deutsche Bank ended up forgiving some of his loan, then extending him hundreds of millions of dollars in new loans in the coming years.As a New York Times columnist was preparing to write about the effort, he received a note from one of Trump’s lawyers: “Please be assured that if your article is not factually correct, we will have no choice but to sue you.”To many journalists, it’s a familiar threat, delivered with a raised voice and repeated for emphasis.“We’ll sue you! We’ll sue you!” yelled a Trump lawyer to Associated Press journalists in a phone interview about Trump University and other defunct Trump ventures in 2016.Trump learned his attack dog legal tactics from one his early legal advisers, the late Roy Cohn, the disbarred lawyer who made his name as a prosecutor in the Julius and Ethel Rosenberg communist spying case that sent the husband and wife to the electric chair, then as aide to Sen. Joe McCarthy during the Red Scare hearings.Under Cohn, Trump countersued the Justice Department after it brought a case against the Trump Organization in the early 1970s for housing discrimination. The Trump Organization eventually settled, admitting no guilt.In the years that followed, the casework never let up.A USA Today investigation found Trump had been involved in at least 3,500 court cases over the course of three decades — more than five other top U.S. real estate owners combined. In more than half of the cases, Trump was the one who had sued.The litigation continued while Trump was in the White House. In a desperate and futile attempt to remain in power, Trump and his allies filed dozens of baseless lawsuits challenging the 2020 election results. Again and again, judges said the plaintiffs had failed to prove fraud or misconduct.Trump had made clear his intentions even before all the votes had been counted.“We’ll be going to the U.S. Supreme Court,” he said during a 2:30 a.m. appearance hours after polls had closed.“He’s exceptionally litigious, much of which is instituted not to win but rather to frustrate the opposing party by causing financial hardship,” said Trump’s former fixer-turned adversary Michael Cohen, who went to jail for making hush money payments to a porn star who alleged an affair with Trump, as well as lying to Congress about a proposed Trump skyscraper in Moscow.When Trump wins — as he did last week in a case involving the porn star Stormy Daniels — Cohen said, “It emboldens him to continue this rampage of litigation for alternative purposes.”The suits have proven beneficial in other ways. Trump  spent more than a year and a half fighting efforts by then-Manhattan District Attorney Cyrus R. Vance Jr. to obtain copies of his tax returns, taking the case all the way to the Supreme Court. While Trump ultimately failed, his stall tactics dragged the case out so long that Vance, who had appeared on the cusp of seeking an indictment, was replaced by a successor who has allegedly all but closed the case.Even family is not immune.In September, Trump sued his estranged niece, Mary Trump, and The New York Times over a 2018 story that challenged Trump’s claims of self-made wealth by documenting how his father, Fred, had given him at least $413 million over the decades, including through tax avoidance schemes. Trump’s lawsuit, filed in state court in New York, accused Mary Trump of breaching a settlement agreement by disclosing the records to the newspaper’s reporters. Mary Trump’s lawyer, Ted Boutrous, wrote in a March 11 letter to the court that Trump’s lawsuit was “brought to punish Mary Trump and to chill speech in the public interest about the former President.”___Tucker reported from Washington. Associated Press writer Michael Sisak contributed to this report.","null"
"1648576662-1444","https://apnews.com/hub/ap-top-news","THE HAGUE, Netherlands (AP) — In what appeared to be a coordinated action to tackle Russian espionage, at least four European allies expelled dozens of Russian diplomats on Tuesday.The expulsions come as relations between Russia and the West have plunged into a deep freeze following Moscow’s invasion of Ukraine.","https://apnews.com/article/russia-ukraine-czech-republic-netherlands-europe-espionage-ecf8770a23a6a3997d32fc07fef4ad80","Europeans expel dozens of Russian envoys to combat espionage","an hour ago","By MIKE CORDER","THE HAGUE, Netherlands (AP) — In what appeared to be a coordinated action to tackle Russian espionage, at least four European allies expelled dozens of Russian diplomats on Tuesday.The expulsions come as relations between Russia and the West have plunged into a deep freeze following Moscow’s invasion of Ukraine.The Netherlands said it was expelling 17 Russians who it described as intelligence officers masquerading as diplomats. Belgium said it was ejecting 21 Russians. The Czech Republic gave one Russian diplomat 72 hours to leave the country. Ireland told four senior Russian officials to leave the country because of activities deemed not “in accordance with international standards of diplomatic behaviour.”North Macedonia announced late Monday it is expelling five Russian diplomats for “activities contrary to the Vienna Convention on Diplomatic Relations.”ADVERTISEMENT“Together with our allies, we are reducing the Russian intelligence presence in the EU,” the Czech Foreign Ministry said.Poland last week expelled 45 Russians whom the government identified as intelligence officers using their diplomatic status as cover to operate in the country. Russia-Ukraine warLive updates: West remains wary of Russia's scale back claimEXPLAINER: What would paying for natural gas in rubles mean?Many in Mideast see hypocrisy in Western embrace of UkraineUkraine's other fight: Growing food for itself and the worldThe Netherlands said it took its decision in consultation with “a number of like-minded countries,” citing similar expulsions by the United States, Poland, Bulgaria, Slovakia, Estonia, Latvia, Lithuania and Montenegro.“The cabinet has decided to do this because of the threat to national security posed by this group,” the Dutch ministry said in a statement. “The intelligence threat against the Netherlands remains high. The current attitude of Russia in a broader sense makes the presence of these intelligence officers undesirable. The deportation is a measure taken in the context of national security.”Dutch Foreign Minister Wopke Hoekstra said he was prepared for a retaliation from Moscow.“Experience shows that Russia does not leave these kinds of measures unanswered,” he said. “We cannot speculate about that, but the Ministry of Foreign Affairs is prepared for various scenarios that may arise in the near future.” That was demonstrated earlier Tuesday, when Russia said it expelled a total of 10 diplomats from the three Baltic EU states of Estonia, Latvia and Lithuania in retaliation for those countries expelling Russian diplomats earlier this month.The Russian Foreign Ministry said it was cancelling the accreditation of four Lithuanian diplomats, three Latvians and three Estonians and they would be required to leave the country. That corresponds to the number of Russian diplomats each country previously expelled.On March 18, the three Baltic countries ordered the expulsion of 10 Russian embassy staff members in a coordinated action taken in solidarity with Ukraine.Moscow called that move “provocative and entirely baseless” and that it had summoned the Estonian, Latvian and Lithuanian ambassadors in Moscow for an official protest.___Follow all AP stories on Russia’s war on Ukraine at https://apnews.com/hub/russia-ukraine.","null"
