web-scraper-order,web-scraper-start-url,ap_news,ap_news-href,headline,date,author,article,image-src
"1648576627-1427","https://apnews.com/hub/ap-top-news","ISLAMABAD (AP) — Taliban hard-liners are turning back the clock in Afghanistan with a flurry of repressive edicts over the past days that hark to their harsh rule from the late 1990s. Girls have been banned from going to school beyond the sixth grade, women are barred from boarding planes if they travel unaccompanied by a male relative.","https://apnews.com/article/afghanistan-taliban-70bf3af0a3ee5d7e876b1f1e35f71682","Taliban hard-liners turning back the clock in Afghanistan","today","By KATHY GANNON","ISLAMABAD (AP) — Taliban hard-liners are turning back the clock in Afghanistan with a flurry of repressive edicts over the past days that hark to their harsh rule from the late 1990s. Girls have been banned from going to school beyond the sixth grade, women are barred from boarding planes if they travel unaccompanied by a male relative. Men and women can only visit public parks on separate days and the use of mobile telephones in universities is prohibited.It doesn’t stop there. International media broadcasts — including the Pashto and Persian BBC services, which broadcast in the two languages of Afghanistan — are off the air as of the weekend. So are foreign drama series. Since the Taliban seized control of the country in mid-August, during the last chaotic weeks of the U.S. and NATO pullout after 20 years of war, the international community has been concerned they would impose the same strict laws as when they previously ruled Afghanistan. ADVERTISEMENTThe latest assault on women’s rights came earlier this month, when the all-male and religiously driven Taliban government broke its promise to allow girls to return to school after the sixth grade. The move stunned much of the world — and many in Afghanistan — especially after the Taliban had given all “the necessary assurances” that this was not going to happen. AfghanistanYo-Yo Ma plays Mozart with Afghan refugees in PortugalCivilian Army leader led child porn ring, risked US securityCivilian Army leader led child porn ring, risked US securityTaliban hard-liners turning back the clock in AfghanistanThe United Nations has called the banning of international media broadcasts “another repressive step against the people of Afghanistan.” The website of the BBC Pashto service said it was “a worrying development at a time of uncertainty and turbulence.” “More than 6 million Afghans consume the BBC’s independent and impartial journalism on TV every week and it is crucial they are not denied access to it in the future,” BBC World Services’ head of languages Tarik Kafala said in a statement Sunday.On Monday, members of the Taliban vice and virtue ministry stood outside government ministries, ordering male employees without traditional turbans and beards — seen as a symbol of piety — to go home. One employee who was told to go home said he didn’t know if and when he would be able to return to work. He spoke on condition of anonymity, fearing for his safety.According to a senior Taliban official and Afghans familiar with the Taliban’s leadership, the push to return to the past — which resulted in the edicts — emerged from a three-day meeting last week in the southern city of Kandahar, the birthplace of the Taliban. They say the edicts stem from the demands of the Taliban’s hard-line supreme leader, Haibatullah Akhundzada, who is apparently trying to steer the country back to the late 1990s, when the Taliban had banned women from education and public spaces, and outlawed music, television and many sports. ADVERTISEMENT“The younger among the Taliban do not agree with some of these edicts but they are not comfortable contradicting the elders,” said Torek Farhadi, an analyst who served as adviser to previous Afghan governments. Farhadi, who has been in contact with Taliban officials since their return to power, did not elaborate.The more pragmatic among the Taliban are resisting the edicts — or at least silently ignoring them, Farhadi said.Since their takeover of the country, the Taliban have been trying to transition from insurgency and war to governing, with the hard-liners increasingly at odds with the pragmatists on how to run a country in the midst of a humanitarian crisis and an economy in free fall. The Taliban leadership today is different from the one-man rule of Mullah Mohammad Omar, the reclusive founder of the Taliban movement in the mid-1990s who reigned with a heavy hand. A divide is growing between some within the old guard, who uphold the harsh rule of the past and a younger generation of Taliban leaders who see a future of engagement with the international community. The younger generation sees rights for both men and women, though still within their interpretation of Islamic law — but one that allows school for girls and women in the workforce.“The younger Taliban need to speak up,” said Farhadi. Still, Akhundzada has modelled himself on Mullah Omar, preferring to stay in remote Kandahar, far from the eyes of the public, rather than rule from the Afghan capital of Kabul. He also adheres to Pashtun tribal mores — traditions where women are hidden away and girls are married off at puberty. Akhunzada ran a madrassa, or a religious school, in Pakistan’s border regions before his 2016 rise as the new Taliban leader. Those with knowledge of Akhunzada say he is unconcerned about international outrage over the latest restrictive Taliban edicts and about the growing discontent and complaints from Afghans, who have become increasingly outspoken. It was Akhunzada who reportedly vetoed the opening of schools to girls after the sixth grade as the Taliban had promised to do in late March, at the start of the new school year. On Saturday, dozens of girls demonstrated in Kabul, demanding the right to go to school. Ethnic Pashtuns elsewhere have resisted Taliban adherence to tribal laws. In Pakistan, where ethnic Pashtuns also dominate the border regions, movements such as the Pashtun Rights Movement have emerged to challenge backward tribal traditions and disavow Taliban interpretations of Islamic law. Manzoor Pashteen, the movement’s leader, has been an outspoken opponent and has accused the Taliban of hijacking ethnic Pashtun sentiments and misrepresenting their traditions — and misinterpreting them as religious edicts.Akhunzada’s onslaught against progress comes at a time when the health of the Taliban-appointed prime minister, also a hard-liner, Hasan Akhund, is reported to be deteriorating. Akhund did not meet with China’s Foreign Minister Wang Yi last week, when the top Chinese diplomat made a surprise one-day visit to Kabul.Farhadi has hope the younger, more pragmatic Taliban leaders will find their voice and urged for an outreach to them by Islamic countries and scholars, as well as Afghan scholars and political figures. “The Taliban movement needs a reform,” said Farhadi. “It is slow to come and it is frustrating for everyone involved. But we mustn’t give up.”___Follow Kathy Gannon on Twitter at www.twitter.com/Kathygannon.","null"
"1648576620-1424","https://apnews.com/hub/ap-top-news","POTTSVILLE, Pa. (AP) — Tractor-trailers and other vehicles lost control and slammed into each other, people leapt away from careering trucks seconds before collision and at least three people were killed and more than a dozen others injured during a snow squall on a Pennsylvania highway Monday.","https://apnews.com/article/media-social-media-pennsylvania-weather-pottsville-c302ca3d1378fd872f35bccffb149226","3 dead in snowy pileup of dozens of vehicles in Pennsylvania","yesterday","null","POTTSVILLE, Pa. (AP) — Tractor-trailers and other vehicles lost control and slammed into each other, people leapt away from careering trucks seconds before collision and at least three people were killed and more than a dozen others injured during a snow squall on a Pennsylvania highway Monday.The crash on Interstate 81 was captured in videos posted on social media that show drivers and passengers lining the snowy road and jumping out of the way as a cascade of crashes unfolds. Dr. David J. Moylan, the Schuylkill County coroner, said three fatalities had been confirmed by late afternoon and that number could rise because fires were impeding rescuers.In one video, an out of control tractor-trailer smashed into a large dump truck turning it nearly 180 degrees, another large truck caught fire and spewed black smoke into the air, and an SUV struck a passenger car sending it spinning narrowly past a person standing on the shoulder in snow and fog.ADVERTISEMENTVideo mounted on the dash of a vehicle showed how quickly the road conditions changed. Stopped vehicles rose like a wall in front of the driver, and a person on the roadway stretched their arms out and jumped to escape the runaway vehicle. The impact sounded like thunder.The Schuylkill County Office of Emergency Management said the crash in northeast Pennsylvania happened around 10:30 a.m. Monday. John Blickley, the agency’s deputy emergency management coordinator, said officials believe a snow squall clouded visibility and likely contributed to the crash.Estimates of the number of vehicles involved from the emergency management agency and state police ranged between 40 and 60, including multiple tractor trailers. Blickley said emergency personnel from four different counties took about 20 patients to area hospitals for treatment. Three tractor trailers carrying unknown cargo were on fire when emergency personnel arrived and some smaller vehicles were also on fire, he said.Pennsylvania State Police Trooper David Beohm said Monday afternoon that the fires were delaying a full investigation.Fire units on the scene included a steady stream of water tankers because the crash is “in the middle of nowhere ... there’s not a fire hydrant out here anywhere,” Boehm said.The highway was snow-covered when the snow squall came through, he said. “All it takes is one person to crash into something and you have to pull off the road, but when you continue to drive at highway speed, this is what happens,” he said.People whose vehicles were in the crash and the “walking wounded” were taken to the Wegman’s distribution center in an industrial park near the crash, he said, and a reunification center had been set up at the Goodwill Fire Company No. 1 in Minersville for people to meet friends or relatives or arrange accommodations.The National Weather Service had warned of “numerous brief heavy snow squalls with very poor visibility.”ADVERTISEMENT“The squalls will quickly reduce the visibility to under one-half of a mile and coat the roads with snow,” forecasters said, urging drivers to get off the road if possible or turn on hazard lights “and gradually slow down to avoid a chain reaction vehicular accident.”Mike Colbert, a forecaster with the National Weather Service office in State College, said the weather service started issuing warnings for snow squalls a few years ago, and pileups of the kind being reported were the reason they began doing so.“They are very heavy snow showers where if you are driving into them, you can go from partly cloudy or sunny skies into an instant blizzard in a matter of seconds. That’s why they are so dangerous,” he said.","null"
"1648576604-1416","https://apnews.com/hub/ap-top-news","WASHINGTON (AP) — A federal judge on Monday asserted it is “more likely than not” that former President Donald Trump committed crimes in his attempt to stop the certification of the 2020 election, ruling to order the release of more than 100 emails from Trump adviser John Eastman  to the committee investigating the insurrection at the U.S.","https://apnews.com/article/capitol-siege-elections-crime-donald-trump-presidential-elections-7b25a5f116f56f73d60b6cb298386bb9","Judge: Trump likely committed crimes related to election","yesterday","By FARNOUSH AMIRI","WASHINGTON (AP) — A federal judge on Monday asserted it is “more likely than not” that former President Donald Trump committed crimes in his attempt to stop the certification of the 2020 election, ruling to order the release of more than 100 emails from Trump adviser John Eastman  to the committee investigating the insurrection at the U.S. Capitol. The ruling by U.S. District Court Judge David Carter marked a major legal win for the House panel as it looks to correspondence from Eastman, the lawyer who was consulting with Trump as he attempted to overturn the presidential election.More coverage– Trump suit against Clinton part of longtime legal strategy“Based on the evidence, the Court finds it more likely than not that President Trump corruptly attempted to obstruct the Joint Session of Congress on January 6, 2021,” Carter, who was nominated by former President Bill Clinton, wrote in the ruling submitted in the federal Central District of California.ADVERTISEMENTEastman was trying to withhold documents from the committee on the basis of an attorney-client privilege claim between him and the former president. The committee responded earlier this month, arguing that there is a legal exception allowing the disclosure of communications regarding ongoing or future crimes.Capitol siegeMan who waved Confederate flag pleads guilty in Capitol riotJan. 6 panel missing roughly 8 hours of Trump's phone callsJan. 6 committee votes to hold Scavino, Navarro in contemptMissouri participant in Capitol riot charged in fatal crashCharles Burnham, an attorney representing Eastman, said in a statement Monday that his client has a responsibility to his attorney-client privilege and his lawsuit against the committee “seeks to fulfill this responsibility.” “It is not an attempt to ‘hide’ documents or ‘obstruct’ congressional investigations, as the January 6th committee falsely claims,” Burnham said. Taylor Budowich, a Trump spokesperson, also responded to the judge’s decision, calling it an “absurd and baseless ruling by a Clinton-appointed Judge in California.” He called the House committee’s investigation a “circus of partisanship.”The March 3 filing from the committee was their most formal effort to link the former president to a federal crime. Lawmakers do not have the power to bring criminal charges on their own and can only make a referral to the Justice Department. The department has been investigating last year’s riot, but it has not given any indication that it is considering seeking charges against Trump.The committee argued in the court documents that Trump and his associates engaged in a “criminal conspiracy” to prevent Congress from certifying Democrat Joe Biden’s victory in the Electoral College. Trump and those working with him then spread false information about the outcome of the presidential election and pressured state officials to overturn the results, potentially violating multiple federal laws, the panel said.The trove of documents the nine-member panel has publicly released so far, which include some emails already retrieved from Eastman, offers an early look at some of the panel’s likely conclusions, which are expected to be submitted in the coming months. The committee says it has interviewed more than 650 witnesses as it investigates the violent siege by Trump supporters, the worst attack on the Capitol in more than two centuries.","null"
"1648576591-1410","https://apnews.com/hub/ap-top-news","NEW YORK (AP) — Walmart will no longer sell cigarettes in some of its stores though tobacco sales can be a significant revenue generator. Wall Street Journal was the first to report the development Monday.","https://apnews.com/article/business-health-lifestyle-dbf337b79224cded50c2d00bd6cb6f7b","Walmart to end cigarette sales in some stores","yesterday","By ANNE D'INNOCENZIO","NEW YORK (AP) — Walmart will no longer sell cigarettes in some of its stores though tobacco sales can be a significant revenue generator. Wall Street Journal was the first to report the development Monday. It noted some stores in California, Florida, Arkansas and New Mexico were on the list, citing anonymous sources and store visits. Walmart is not the first national retail chain to cut off cigarette sales even on a trial basis, but it is the largest. Target ended cigarette sales in 1996 and the drugstore chain CVS Health did the same in 2014. CVS Health sales in areas outside the pharmacy fell for a few quarters after it pulled tobacco products, and the company had predicted that missing tobacco products would hurt annual earnings by 7 to 8 cents per share.Overall revenue has grown every year at CVS, however, after a number of acquisitions and changes to its stores bolstered the company’s health care offerings. CVS Health bought the health insurer Aetna in 2017.ADVERTISEMENTDecisions about removing cigarettes at Walmart will be made on a store-by-store basis according to the business and particular market, the company said Monday.HealthFDA OKs another Pfizer, Moderna COVID booster for 50 and upAmericans ease up on masks, virus safeguards: AP-NORC pollEU regulator starts reviewing Spanish COVID vaccine boosterOscar wins for 'CODA' bring tears, elation to Deaf community“We are always looking at ways to meet our customers’ needs while still operating an efficient business,” Walmart said in a prepared statement. Health officials say that cigarette smoking causes about one of every five deaths in the U.S. each year.Walmart Inc., based in Bentonville, Arkansas, announced in 2019 that it was getting out of the vaping business and would stop selling electronic cigarettes at its stores and also at Sam’s Clubs. It said at the time the decision was based on “growing federal, state and local regulatory complexity.” ___AP Health writer Tom Murphy in Indianapolis contributed to this report. ____Follow Anne D’Innocenzio: http://twitter.com/ADInnocenzio","null"
"1648576616-1422","https://apnews.com/hub/ap-top-news","TALLAHASSEE, Fla. (AP) — Florida Gov. Ron DeSantis signed a bill into law on Monday that forbids instruction on sexual orientation and gender identity in kindergarten through third grade, a policy that has drawn intense national scrutiny from critics who argue it marginalizes LGBTQ people.","https://apnews.com/article/florida-dont-say-gay-law-signed-56aee61f075a12663f25990c7b31624d","‘Don’t Say Gay’ bill signed by Florida Gov. Ron DeSantis","yesterday","By ANTHONY IZAGUIRRE","TALLAHASSEE, Fla. (AP) — Florida Gov. Ron DeSantis signed a bill into law on Monday that forbids instruction on sexual orientation and gender identity in kindergarten through third grade, a policy that has drawn intense national scrutiny from critics who argue it marginalizes LGBTQ people.The legislation has pushed Florida and DeSantis, an ascending Republican and  potential 2024 presidential candidate, to the forefront of the country’s culture wars. LGBTQ advocates, students, Democrats, the entertainment industry and the White House have dubbed the measure the “Don’t Say Gay” law. DeSantis and other Republicans have repeatedly said the measure is reasonable and that parents, not teachers, should be broaching subjects of sexual orientation and gender identity with their children. The law went into effect just days after DeSantis signed a separate bill that potentially restricts what books elementary schools can keep in their libraries or use for instruction. PoliticsJan. 6 panel missing roughly 8 hours of Trump's phone callsCivilian Army leader led child porn ring, risked US securityBiden budget has Manchin priorities: Tax rich, cut deficitAmericans ease up on masks, virus safeguards: AP-NORC pollADVERTISEMENT“We will make sure that parents can send their kids to school to get an education, not an indoctrination,” DeSantis said to applause before he signed the sexual orientation and gender identity measure during a ceremony at a preparatory school outside Tampa.The law states: “Classroom instruction by school personnel or third parties on sexual orientation or gender identity may not occur in kindergarten through grade 3 or in a manner that is not age appropriate or developmentally appropriate for students in accordance with state standards.” Parents would be able to sue districts over violations.Public backlash began almost immediately after the bill was introduced, with early criticism lobbed by Chasten Buttigieg, the husband of U.S. Transportation Secretary Pete Buttigieg, and condemnation from LGBTQ advocacy groups. Democratic President Joe Biden called it “hateful.” As the bill moved through the legislature, celebrities mobilized against it on social media, and criticized it at this year’s Academy Awards. Florida students staged walkouts and packed into committee rooms and statehouse halls to protest the measure, often with booming chants of “We say gay!” ADVERTISEMENTThe Walt Disney Company, a powerful player in Florida politics, suspended its political donations in the state, and LGBTQ advocates who work for the company criticized CEO Bob Chapek for what they said was his slow response speaking out against the bill. Some walked off the job in protest. After DeSantis signed the measure, Disney released a statement saying, “Our goal as a company is for this law to be repealed by the legislature or struck down in the courts, and we remain committed to supporting the national and state organizations working to achieve that.”Throughout debate in the GOP-controlled statehouse, Democrats have said the law’s language, particularly the phrases “classroom instruction” and “age appropriate,” could be interpreted so broadly that discussion in any grade could trigger lawsuits and create a classroom atmosphere where teachers would avoid the subjects entirely.“The bill’s intentionally vague language leaves teachers afraid to talk to their students and opens up school districts to costly and frivolous litigation from those seeking to exclude LGBTQ people from any grade level,” said state Rep. Carlos G. Smith, a Democrat who is gay. “Even worse, #DontSayGay sends a hateful message to our most vulnerable youth who simply need our support.”Andrew Spar, president of the Florida Education Association, said the law amounts to a political wedge issue for Republicans because elementary schools, especially in kindergarten through third grade, do not teach about these subjects and have state curriculum standards guiding classroom lessons. “This bill is based on a falsehood, and that falsehood is that somehow we’re teaching kids inappropriate topics at an early age, and clearly we’re not,” Spar said.The law’s sponsor, Republican Rep. Joe Harding, has said it would not bar spontaneous discussions about sexual orientation or gender identity in schools but would prevent districts from integrating the subjects into official curriculum. During the bill’s early stages, Harding sought to require schools to inform parents if a student came out as LGBTQ to a teacher. He withdrew the amendment after it picked up attention online.“Nothing in the amendment was about outing a student. Rather than battle misinformation related to the amendment, I decided to focus on the primary bill that empowers parents to be engaged in their children’s lives,” he said in a statement.DeSantis signed the bill after a news conference held at the Classical Preparatory School in Spring Hill, about 46 miles (74 kilometers) north of Tampa. At the ceremony, several young children accompanied DeSantis and other politicians near the podium, with some holding signs bearing the governor’s “Protect Children/Support Parents” slogan. DeSantis gave the children the pens he used to sign the bill.The White House, which has sparred with the DeSantis administration over a range of policies, has issued statements against the law. “My Administration will continue to fight for dignity and opportunity for every student and family — in Florida and around the country,” Biden tweeted Monday.U.S. Secretary of Education Miguel Cardona recently held a call with LGBTQ students in Florida and said in a statement issued Monday that his agency “will be monitoring this law upon implementation to evaluate whether it violates federal civil rights law.”For teachers in Florida, the law has caused some confusion over what is allowed in the classroom as well as concerns over frivolous lawsuits, said Michael Woods, a special education teacher in Palm Beach County with about three decades of experience.“From the start, I thought it was a solution in search of a problem, and the sad part about it is, I think it’s going to have a chilling effect on making sure that young people, students have a safe learning environment,” he said. ___This story has been edited to clarify that Disney people who walked off the job were not theme park workers, but other employees of the company.","null"
